 Yeah, Ryan snapped at me, but there was this twinkle in his eye that I picked up on, which said, "Dude, were friends. Im doing this for appearances. I am the big boss now. And I have to seem like an ogre. But you know me and you trust me. And we like each other. And well always be friends. And I would never take you for granted in a million years. And I miss you, man. And I love you." His words.
 OOhh. Gimmme, gimme, gimme, gimme, gimme, gimme.
 Ryan Howard everybody.  Good job.
 Who is?
 I am not old. You are old. You are like a hundred.
 Yeah, kay. I was just... After the presentation, just wanted to make sure, that vis-a-vie, that everything in the office is business as usual?
 Yeah, I know I understand... were making great strides and were updating, but business as usual, no?
 Good, so, were on the same page?
 We had a foreign exchange student live with us when I was young. And we called him my brother. And thats who I thought he was. Um, then he went home to what is now formerly Yugoslavia, taking all of my blue jeans with him. And I had to spend the entire winter in shorts. That is what Ryan is like. A fake brother who steals your jeans.
 Hey.
  Hey, what is the actual deal with these things in terms of testicles?
 I dont want to grow weird sperm in case we ever want to have kids.
 Oh, I dunno, theyre launching a big new business plan. New website, blah blah blah. Hes being a real twerp about it, so, its all about youth, and agility and streamlining and trying to squeeze out the older people.
 Well...
 What is that... word?
 So older people have just as many rights as younger people?
 Good, were all here, we can get started.
 Have a seat.
 Have a seat. Like everybody else.
 Still my office, Ryan.  Well, there has been a lot of talk about new ideas today. Well, new ideas are fine, but they are also... illegal, because they are a form of ageism. What? Yes, I am right. Did you know that the Age Discrimination and Employment Act of 1967 prohibits employment discrimination based on age with respect to employees 40 years of age or older? I did.
 Hey, shut up Toby. Look, why do we as a society hate old people so much?
 No, Creed, no they are not. In fact, many cultures revere old people because of their storytelling ability. Like the old lady from Titanic.  Or the funny things that they can do, like "wheres the Beef?"   Yeah.
 I was going to put up some new pictures, but umm, all of the ink in the printer was gone.
  That is me. Come on in.  Who is this old fart? Did you just stagger off the street? Out of a box or something? Whos this worthless bag of bones? Well, this guy is none other than one of the founders of Dunder Mifflin, Mr. Robert Dunder. Huh?
 Sure thing.  Scuse me.
 Fine. Then I will call David Wallace and you can explain to him why you threw the founder of the company out on his ancient butt.
 Bob, how old are you?
 Eighty-seven years young. And still active. That is great. Did you know, that Bob is still a member of the Board of Dunder Mifflin?
 Ah, still sends his own proxy. Good for you.
 Wow.
 Oh, boy.
 Great.
 Great.
 Thats great. Thank you for coming in.  Robert Dunder everybody.  Thank you. That was wonderful. Do you have a ride?
 Perfect.
 Inspirational. What have we learned?  Well, we have learned that you cant teach an old dog new tricks, because its illegal, and you will go to jail.
 No, No. Dont help him. He doesnt need help, Pam.  What a nice guy.
 Good night guys.
 I disagree, I think it was very valuable.
 I happen to think the old ways of doing business are better. And I can prove it.
 Smell that. Do you smell that?
 No, Dwight. That smells like good business to me. What I have done here is I have collected all the finest gourmet items that Scranton has to offer.
 Yes, no! No, those are for our clients. Actually, our exclients. Ill explain, later.
 Ryan wants everything in our company to be about emails and IMs, but I think hes forgetting about the original instant message. Letters attatched to baskets of food.
 Hey boss, I didnt know you were coming in today.
 I am glad that you asked, listen up everybody. In the last year, we have lost seven clients to the big chains. These gift baskets are our ticket back into their lives. We are going to show up at these businesses unannounced, and we are going to win them back.
 With peanut brittle, with macadamia nut cookies, with chocolate turtles, with raspberry jam and a little bit of fat and salt because you know what? Thats what people like.
 Ever since I was a kid people have been telling me I cant do things. "You cant be on the team", "You cant move on to second grade". Well, now theyre telling me that I cant win back clients using old fashioned business methods.  Well see about that. And FYI, I eventually aced second grade, and I was the biggest kid in class.
 OK. Were gonna split up into teams. Jim, Phyllis. Stanley, Dwight. Me Andy.
 Why dont we just go as teams to demonstrate our teamsmanship?
 Yes?
 OK, thats not helpful Phyllis.
 Gift baskets are amazing, Phyllis. Gift baskets are... the essence of class and fanciness. They are the ultimate present that a person can recieve.
 Fine, Im just going to go by myself, and I am going to win them back by myself because this is important to me.
 No, this is my quest.
 Fine. Then God speed. To both of us.
 We dont need luck.
 But thank you, that was really nice of you to say.
 Business to business. The old fasioned way. No Blackberrys, no websites. I would like to see a website deliver baskets of food to people.
 It is in the body shop. Had to have the dent taken out of the hood where I hit Meredith.
 I know. So whos next?
 Who?
  Wow, those things are heavy! Theres a lot of stuff in there. We have macadamia nut cookies, um, the honey mustard pretzels. Have you ever tried focaccia crisps?
 Yes we do.
 Well...
 Mmhmm.
 OK, you know what? Just enjoy the gift basket and remember that we provide a personal touch.
 Well just, uh enjoy the gift basket.
 Alright.
  That guy was so... how can they not know how much better we are?
 That is true.
 Yes, she is nuts.
 How do they know? How does this know where to turn? Thats very impressive.
 And the last guy says "No, hairy body".
 Ah, well its still very good. I bet I know someone who hasnt heard that joke... your daughter Emily. Hows she doing?
 Shes gonna be like eleven this winter? Wow, they grow up so fast. I have a few of my own that I want some day. Listen, I dont want to take any more of your time, I know youre a very busy man. The reason we have stopped by is to drop you off this elaborate bag of goodies, and to ask you to reconsider.
 OK, OK! So youll reconsider?
 Ah... .is that all you have to say?
 Look, we want you back.
 Well, no.
 No its not.
 Why would he come back? I will tell you, Dwight. He would come back because we offer a wide selection of products and because youre definitely not getting the same sort of customer service that you get with us.
 Look... were also coming out with a website soon. Its a state of the art thing, itll be up and running, its gonna cut costs and it will make ordering much much easier.
 Great, the magic of the gift basket.
 OK, good. Dont let Emily have any of the cajun almonds, shes alergic.
 I dont get it, I really dont get it. I thought this would work. I do everything I had at that guy and nothing.
 That is a very good point, Dwight.
 No, it said right, it said take a right.
 Maybe its a shortcut Dwight. It said go to the right.
 The machine knows where it is going!
 The machine knows--- stop yelling at me!
 Let go, let go of me!
  You sure youre OK?
 Good, that is whats most important.
 What a disaster, this whole thing.
 These people just dont realize what a gift basket means, they dont get it.
 What about that last guy, Aaron? Is he a jerk. "I dont even know if I want it. Theyre website is so easy". Yeah, well, you can have your technology jackass, look where it got us.
 Hang up.  You know what were gonna do? Were walking back. Were walking back to that office and were gonna reclaim our gift basket!
 Were gonna take whats rightfully ours! Were gonna take a stand, Dwight! Were gonna take a stand!
 Give it back. The gift basket, give it back.
 Yeah, maybe we should, maybe we should leave. Come on, lets leave, but before we leave my wet friend and I are going to wait for our cabs on yours nice couches!
 Look, my clothes are so wet!
 Its been opened.
 Whats missing... the turtles. Where are the turtles? Where are the turtles?
 WHERE ARE THE TURTLES? WHERE ARE THEY?
 May I have your attention please? This office will not be using any new technology ever, starting now.
 Ryan thinks that technology is the answer. Well guess what? I just drove my car into a lake.
 I drove my car into a  lake. Why you may ask did I do this? Well, because of a machine. A machine told me to drive into a lake. And I did it! I did it because I trusted Ryans precious technology, and look where it got me.
 Exactly!
 Maybe, maybe not, time will tell. But I will tell you one thing. Those gift baskets never endangered anybodys lives.  Game set match... point... Scott... game over... end of game.
 Everyone always wants new things. Everybody likes new inventions, new technology. People will never be replaced by machines. In the end, life and business are about human connections. And computers are about trying to murder you in a lake. And to me the choice is easy.
 And the same thing goes for quarterly reports.  They are unreadable.  Theyre just numbers and boring and blech.  So what I was thinking is that maybe we should have some sort of graphic, like if we have a bad quarter, put in a storm cloud? And... when we have a good quarter, fireworks? Or a racecar?  Doesnt have to be a racecar.  Use your imagination.
  We have a lot of colored paper here... why oh why do we keep printing this on white?
  Yeah!  I know.  I know.  Its bland.
 Maybe, we could have some sort of riddle?
 Like, something that you have to look for.  Sort of a "Wheres Waldo."
  Alright. Alright.  Lets quit while were ahead.
  That was awesome. Thank you.
  Some days I am just on fire.  What can I say?
  Oh, does he?
  Mmmmmm.  Okay.  Attention.  Earthlings.  I have some news.  Beep beep beep beep, beep beep beep beep beep, beep beep beep beep beep, beep beep beep beep beep, beep beep beep beep.  Okay.  Today is the big day that I am heading to New York to attend a party with sushi and important people.  On an unrelated note, if anyone has an interesting anectdote that is not boring and easy to memorize please drop by my office before I leave.  Thank you.
  And... today the Dunder-Mifflin Infinity website officially launches.
  Well the website is the brain-child of my brain-child, Ryan.  It is my brain-grandchild. And, uh, to celebrate its birth, all of the different branches are going to have satellite parties, which will be connected via web-cams and fibers to the real party, which is going on in New York City at uh, a very exclusive nightclub, and that is where all of the VIPs, including yours truly, will be partying with uh New York Citys finest, and I do not mean policemen...
  The company is projecting record high sales, and that by 600 the website will be the new best salesman in the company.  Wow!  Watch out Dwight.
  No.  It doesnt.  Ill find out tonight.
  Whats that, pipsqueak?
 Ohh, lunch party.
 Okay, wow!  Easy, booster seat, nobody cares about this party anyway.
  Okay.
  Really?
 Its the European cut.
  Umm... hey.  Ah, whats hanging?
  Oh good.  Okay cool.  How many pounds do you think I could lose by 7?
  I had um, one of those danishes.
  Why dont you wanna go tonight?  What... all your friends are gonna be there.  Itll be fun.
  Just...
  Yeah.
  Thank you.
  Na... no.  No.  If I go by myself everybody will think Im a big loser.
  Do I have your permission to invite Carol?
  Im sorry. Im sorry.  Its just the first... girl that popped into my head.  Ill find somebody I havent slept with.
  So.  This is the dealio.  God has smiled upon me and given me two tickets to the big party in New York tonight.  What are you doing this evening?  Look at that.  They have their own little language now. Like twins.
  Alright.  Well fight it out amongst yourselves.  I was thinking Pammy but boys night out is also good.
  Just let me know who the winner is.
  Alright.  Im ready to go and Im callin shotgun.
  Yes.  Thank you.
  Oh yeah, youd better.  You better say good-bye to Pam.  Say good-bye to Pam.  Byyyyyye.  I love you.    I love ya Pam... okay.    Im leavin inside Jims car, I dont know when Ill be back again.  Yes I do.  Tomorrow Ill be back.  Ill be back.  Tomorrow.  Um... yeah.  So you know what?  Why dont you guys take off a little bit early tonight?
  If you are not this tall, you may not ride the rollercoaster.  See you guys tomorrow.
  You ever read this?
  Got it for Ryan.  Wanted to get him Oh The Places Youll Go, but they were sold out.  Figured...
  Same sort of stuff in here.
  Mmwa.  Mmwa.
  Leaving Pennsylvania.
  One for me one for Jan.
  You guys should come over for dinner.  You and Pam.  Thatd be fun.  Friday?
  Wanna come over Friday?
  After work you guys...
  Yes.  Actually I will tell you right now.  Its a club called Chatroom, and theres a password to get in, which is actually password.  So...
  What are you doing?
  No.
  No, Im sure thats not.  Na...
  Yes.
  Well the invitation says VIPs only.  Is this how you treat your VIPs, Ryan?  Were already in the city.  The main part with the buildings.  What am I supposed to do?  What do you want me to do tonight?  And if you tell me, that I have to drive back to Scranton, to the satellite party, I am going to throw up!  Okay Im going to throw up.  Im throwing up.  Youre making me throw up, Ryan.
  You know what this is like?  Ill tell you what this is like. This is like when the Freshmen would throw a party and wouldnt let any of the Seniors go.
  Doesnt it just piss you off sometimes that that little twerp got the promotion over us?
  Yeah.  I withdrew too.
  Alright who wants to party?
  Ohhh, what?  Oh I think I faked Oscar out.
  I think I faked Stanley out too.  Who else thought that I was leaving?  And they could all go home early?  Gotcha.  Gotcha.  Gotcha.  Well who needs New York?  Right?  We can have a killer party right here in Scranton.
  Nope nope nope no.  This is going to be nothing like the party youve been planning.  This is going to be good and everybodys gonna come.  Whats wrong with Dwight?
  Oh hey!  Good for you.  Good for you.  Scranton power.  Alright you know what?  Angela Id like you to come into my office in ten minutes. Bring something to write with and something to write on.  Good.
  This was a pretty disappointing day.  It was kind of a slap in the face to realize that I wasnt as important as I thought I was to a certain young executive who I cared about.  But, you know, Im not gonna cry over it.  I did that in the car on the way home.
  How we doing on time?
  Good.  These are some things that I would like to have happen.
  Mmmhmm.
  Those are just things.  This is how I want it to feel.
  I would like this party to be sexier, cooler, more important...
  Yes
  Uh...
  I want it...
  I want it to embarrass all other parties.  I want it to be a party that the guys in New York watch on the web-cam and say, "Wow! How did they get Al Roker to come?"
  Yes you can.
  Yes you can.  I know you can.  I wouldnt say that if I didnt hundred percent believe it.  Who else could do this?
  No seriously.  Is there anyone else who could do it better?  Because we dont have a lot of time.  Ill get the pizza!
 Good news.
 Guess who just ordered from your favorite pizza place, Alfredo?
 Same thing.
 You know what?  I dont understand when you all talk at the same time.
 Pizza by Alfredo.
 Okay, okay, whats better?  A medium amount of good pizza?  Or all you can eat of pretty good pizza?
||
 Yup.
 You dont have to say it like that.
 Hey
 Right, I have a coupon, so half of sixty-three fifty, and half the tip of sixty-three fifty.
 Yeah, I told them on the phone that I was ordering eight pizzas.
 You didnt actually think I was going to spend sixty bucks on pizza?
 Okay, it doesnt say it anywhere on the coupon, and if its policy, it should say it on the coupon.
  What do you mean hmm-um?
 It is your problem.  Thats no way to do business, okay? I ordered eight pizzas with a half-off coupon, so I would like eight pizzas for half-off.  End of story.
 Im not giving that to you.
  No, no youre not going anywhere.  Youre staying here until we figure this out.
 You know what?  This young man needs to learn thats not how you treat people.  I dont care if its pizza.  Good business is about respect and accountability and follow through.  You dont just make promises and pull the rug out from under somebody, do you?  Dwight, please escort this young man into the conference room.  Right now, get in the conference room.
 Yes you are, yes you are, and you will come out when you decide to give me a discount on the pizza.  Please, thank you.
 No, you dont even know what stupid is.  Its about to get all stupid up in here.
 You ready to give me my discount now?
 Okay, what have you been doing in here this whole time?
 Alright, Dwight, knock it off.  You better think about what you are doing young man.
 No!  Im an adult, I dont have to think or do anything.  Youre a kid, a little snot-nosed, punk kid who thinks hes better than everyone else, because hes some hot shot, and you dont know anything about sales.  So stop being a disrespectful little jerk, okay?
 Yeah sales, you sell pizza.  Last time I checked thats called sales.
 Alright stop, stop making him say it!  You just made this worse, a whole lot worse.
 Stop talking all at once!
 Let go of the little jerk boy before he has learned his lesson?
 You know what Jim, the world would be a better place if people were held accountable for their actions.
 Im not kidnapping him, Im keeping him until I get what I want.
 I think youre over-thinking it.
 Yes, is Alfredo there?  Can I speak to a manager then?  Okay, can you tell the manager that Im keeping his delivery kid until I get a discount on the eight pizzas I ordered.  Yes, I know it is not on the coupon.  Also I would like him to throw in two, three pizzas for our...
 Trouble.  Okay, alright.
 He said no.
 No, no.
 Mister Overdramatic, whats up Kevin?
 Ill just wave and introduce myself.
 Hey, I just think you should know that one of my salesmen beat your stupid computer, so take that hole.
 Hey, have you seen Jim?
 Whoa, whoa, whoa, whoa, what are you doing?
 Hey, hey, hey stop it.  Stop it now, God. Oh my God, oh my God, no, no, no.  I kidnapped a kid.
 I could have paid for the pizza.
 Oh my God, oh my God.
 This is Michael.
 Youre breaking up. I cant hear you.
  Mmm-kay.  I want you to go in there, and pay him for the pizzas, and give him a generous tip, no more than ten percent.
 I will open the door.
 And hopefully he will walk out, and the rest is out of our hands.
 Yes.
 See ya, drive safely.
  Okay.
 Now we wait, and hopefully nothing happens.
 Not now Dwight, please, its not the time.
 What a horrible day.
 Bluh.
 Well, I need to get the horrible taste of this pizza out of my mouth.  Id really like some sushi.  I was hoping that I would have New York style sushi today.  And you know what?
 Im going to get it.
 Uh-uh, no, there is only one place where they authentic New York style sushi.
 New York.  Wanna go?
 Alright, you drive.
 Here we go.
 Mmm.
 Hey, you know what?  Come on, come on, lets go.
 Guilty.
 Oh, thanks.  This is the guy that beat the computer.
 Yeah.
  Im Ryan, and tonight didnt go the way that I thought it would, because it didnt work out for me, and Im very embarrassed.  I got egg all over my face.
 I never sold any paper, because Im an idiot.
 I made it with my cheese pita.
 I started a fire, I started a fire.
 And Im hot, Im so hot. Thats why everybody...
 Well, its part of it, its just the... uhhh.
 Wanna head back?
 Coat!
 Steak! Wheres my steeaaak?
 Get me Armani.
 On the phone.
 Wheres Armani? Hes on the phone. Too slow. You are not going to Paris. Im so much better than you are.
 I owe you an apology.
 Yeah. It was awesome. Big surprise ending. Wont ruin it for you.
 Meryl Streep is the bad guy. Never see it coming. Anyways, if I was mean in any way to you, I am sorry. I just want whats best for you, Mo Chuisle.
 I havent heard the same about you. So lets just go with mine.
 We already have a sofa. So why do---
 It... folds up. Youve only seen it flat.
 I--- Ok. How much is this going to cost?
 Yes. Money has been a little tight lately. But, at the end of my life, when Im sitting on my yacht, am I gonna be thinking about how much money I have? No. Im going to be thinking about how many friends I have, and my children, and my comedy albums. I mean, I have a yacht, so I obviously did pretty well money wise.
 Its just that you say its gonna cost what it costs---
 Put him through. Yes. Ryan, my man!
 Yes, and thank you for sending that to me.
 Okay, yeah, I dunno. I dunno, I think those IT guys messed up.
  Wait, oh, no, here it is, here it is. Found it.
 Oh! Um, actually, I need the car.
 Use to have two cars, traded em in, now were down to one. Good economic sense. Although the new car is a Porsche. For her.
 You can not, I have a thing tonight.
 What?
 Oh no, I have a thing tonight.
 How about this weekend?
 Dammit to hell. I-I-ugh, ok. All right.
 You wouldnt understand. Its a secret.
 Im sorry Mr. OBrian, I didnt mean to interrupt your dinner. I just have a very exciting offer. My records indicate that you have expressed interest in losing some weight. Well, what if I told you that I have a pill that will make you 50 pounds lighter in 5 minutes? How does that sound? Amazing right? Well, it wont be that fast, but it will---- it will be that easy.
 I just love sales. I love it to death. Its as simple as that. And I dont get to do it enough as a manager, so I took this second job. I count it as a hobby. Some people have golf, or relaxing.
 Hey, I just got off the phone, and I was gonna make another call.
 No, theyre with me, so... this is Nick Figaro, manager to the stars!
 These meetings are useless.
 Very inspirational.
 Or a trained seal.
 Yes, is Mr. Hudson there?
 Im just calling because you responded positively to the---
  ...Stanley?
  Senor, are you happy with your---
  Have you--- Have you considered satellite television?
 Well your son sounds like hes really motivated. I think its crazy the coach wont play him frankly.
 You bet.
 Look, I know sales, and I had that sale, I just needed a few more minutes---
 It is not a waste of our time.
 Vikram doesnt have my people skills.
 Well, I hope this conversation has helped.
 What did you get tonight?
 Oh, that looks good.
 I am going with the vanilla crisp this evening.
 Thank you.
 Really?
 Wonder what I wouldve been back home?
 I know, but its competitive here. Whats a dollar worth in your land? Medical school must cost like 40 bucks or a donkey or something.
 I wouldve been chief of surgery... Or a cowboy.
 You know what, heres the thing about Die Hard 4. Die Hard one, the original, John McClane was just this normal guy. You know, hes just a normal New York City cop, who gets his feet cut, and gets beat up. But hes an everyday guy. In Die Hard 4, he is jumping a motorcycle into a helicopter. In air. You know? Hes invincible. It just sort of lost what Die Hard was. Its not Terminator.
 I actually wrote a movie.
 Im writing one, yeah.
 Um, sort of a spy, thriller...
 Thanks, no, I have work tomorrow morning.
 Okay, see you guys.  Hey, how you doin?
 Okay. Hows yoga?
 Wh-Why not?
 Okay.
 Good night Vikram.
 Hey, congrats on the bonus.
 Im gonna have it one of these nights.
 Good night.
 Um... that wasnt much of an introduction.
 Ahh, still lame. Okay. All right. Thank you, Ryan, for that wonderful introduction. Okay, um, today were gonna be talking... about...PowerPoint! PowerPoint! PowerPoint! PowerPoint!
 Yes I forgot about Ryans presentation. And yes, it would have been nice to do well with the first presentation he had given me. But you know what else would have been nice? Winning the lottery.
 And the best way to start is to hit start. And up comes the toolbar, thats what she said. What we have to do here is go to Run, and then you look up to PowerPoint. And we are in. We are going to register. You hit register--- Updates are ready. I should update. Um, estimated time 12 minutes, so this should take 5 or 10 minutes.
 Why?
 No, I had a really rough night, and my boss can back you up on that.
 My other boss, Mr. Figaro.
 What I do between 530 pm and 1 am is no ones business but mine and my other business.
 It wont.
 Okay, honestly, it was unlikely I was gonna figure this out anyways.
 Why dont you do the presentation, because you know how to do it?
 Huh, okay.
 Its whoever, not whomever.
 No, whomever is never actually right.
 Not a native speaker.
 Well it sounds right, but is it?
 Thank you.
 No one, uh, asked you anything ever, so whomevers name is Toby, why dont you take a letter opener and stick it into your skull.
 Ive never done this before. Ive never quit anything in my life.  So, you are filming history.
 Nick, I had a dream last night that I had two full time jobs.  One here at the Lipophedrazone diet pill company---
 And the other I was a Regional Manager of a small paper supply company called Dunder Mifflin.
 In this dream I did both of these jobs beautifully, and I loved it, and everybody loved me.  But the truth is, I cant do this.
 I am.
