 I was never in this for the money.  But it turns out that the money was an absolute necessity for me.  I tried to live the dream.  I tried to have a job, a girlfriend, another job, and I failed.  But the good thing about the American dream is that you can just go to sleep, and try it all again the next night.
 Hey Kevin, youre a gambler right?  A rounder, you play the ponies, small horses.
 Yeah, I was thinking about doing some gambling myself.  You know, just a little bit of money.  Maybe doubling it, and them doubling it seven more times.  I dont know, kind of just for fun.  I was thinking, do you have tips, or ideas about sure things.  Like a boxer who is going to throw the big fight, you know, like, like hes tied into some crooked dealings, maybe his kid is sick or something.  Like, who do I call about that?
 Do you know anybody in the mob?
 Okay, um, Oscar, Im going to need to take another advance on my salary.
 Hey guys.
 Whatcha talking about?    Okay, I know whats going on.  Youre talking about Jim and Pam, if theyre having sex, what it looks like, I know, I think---
 Hey, hey, hey.
 Monkey problem? No, Im not having monkey problems.  Why would I have monkey problems?
 Oh, I hate monkeys.
 I dont have a second job.  Maybe Im having an affair with Suzanne Summers.
 I dont talk to my girlfriend about money.  It is rude, and unsexual.
 I totally agree with you.  But I dont have money problems, I dont.  Alright, you know what?  Watch this, if I had money problems, would I do this?
 Yeah, but I destroyed it, its not even useable anymore.
 No you didnt.
 How would that help Creed?  In Monopoly when you go bankrupt, you lose.
 That is a good point.
 Like the witness protection program.
 Ive always wanted to be in the witness protection program.  Fresh start, no debts, no baggage.  Ive already got my name picked out, Lord Rupert Everton.  Im a shipping merchant who raises fancy dogs.  Thats the life.
 I... DECLARE... BANKRUPTCY!
 I didnt say it, I declared it.
 Yeah, tell me about it.
 You know, Jan has my credit cards, and shes using them as if Im made of money, she thinks Im a human ATM machine.
 Oh, thats the Muppet Show, on DVD, classic.
 That is by far the best way to strengthen your core.  This machine, you sit on a stabilizer ball, you put your feet into the power stir-ups, you reach up and you grab onto the super rod, and you twist, and you twist, and you twist.  It strengthens your entire core.  Your back core, your arm core, the Marine Core actually uses it.  I think thats how they got a core.
 Mm-hm.  That is so cool how you have my name at the top.
 Right.
 How do they do this so fast?  Is this power-point?
 No, no, we are going to leave Jan out of this.
 We will find another way, well ask power-point.
 Youre a presentation tool if you think Im gonna tell Jan about this.
 No youre not! Ok, just... youre not a tool. Look, well tell her that its bad, but it couldve been a lot worse but due to some fancy financial foot work I was able to cut it in half.
 She poses.
 Um, thats, how did you get that from what Oscars saying?
 What am I doing? I am blowing dodge. Im getting out of town. Whatever you call it, I am running away from my responsibilities. And it feels good.
  Runaway train, never come back.  Runaway and Im never coming back.
 Hey Jan.
 Not much, whats up with you?
 Im out of answers Jan.
 I told you, no more answers.  This is who I am now.  A guy on a train with no answers.  I hope that can be enough for you.
 I dont know that.
 Ill stay off the grid.
 Yeah it is, it is.  I really messed up.
 Thats really nice of you to say.
 I think the engineer left.
 Dont sell your implants please.
 Thats nice though.
 It looks cute though.
 Yeah! Everything! Oh its all good, its all good. Phyllis!
 Dancing babies! I love it! I love it!
 We are making a commercial for Dunder Mifflin today. Our first ad ever.  Corporate purchased some air time in local markets to spread the word about Dunder Mifflin Infinity and they are even sending up a professional ad company to help us make it later so... its uh, not too shabby.
 Okay, its football cream. Its football cream. Alright! So, anybody else?
 Look at that. Even the receptionist is getting in on the creativity. Very good, very good.
 Hello hello!
 Michael Scott.
 Regional manager.
 Excited to talk ideas.
 You know, I want this to be cutting edge. I want it to be fast, quick cuts, you know, youthful, sort of a MTV on crack kind of thing.
 All right, good, well this is what we have to work with.
 I would like you to meet Andrew Bernard. The Nard Dog. Who let the Nard Dog out?
 He gives the best back rubs in the office.
 Now this gentleman right here is the key to our urban vibe.
 Stanley is hilarious. Phyllis is like our Mrs. Butterworth. Kind of a less urban Aunt Jemima.
 These are our accountants. And as you can see they are very different sizes. What you might want to do is kind of a Papa Bear, Mama Bear, Baby Bear thing. That might be kind of fun.
 Who else?
  Little girl in a field holding a flower, we zoom back to find that shes in the desert and the field is an oasis. Zoom back further the desert is a sandbox in the worlds largest resort hotel. Zoom back further the hotel is actually the playground for the worlds largest prison.  But we zoom back further---
 Actually I dont get paid by the hour anymore, but thank you, I get paid by the year, so...
 Yeah, I know.
 Mmm. Okay.
 Thats what Nassau came up with? That sucks!  Whoa.
 Well we can do better than that.
 The waving?
  Shrek! Shrek, Im a donkey! Im a donkey, Shrek!  Im just kidding. Its me. Hello Ry.
 Okay, calm down. I have a small problem.
 Yeah, well when I call about big problems you dont like that either, so make up you mind, kiddo. Here is the deal, the ad guys that you sent are locking me in a creative box, and sort of ignoring my ideas.
 Im creative, Ryan.
 Well actually I cant cook, and I am starting a restaurant. Mikes Cereal Shack. Im thinking well have as many varieties as you can buy in the store.
 Yeah!
 Are you? I dont think youre doing such a good job here, suppressing ideas and creativity.
 All right, let me ask you this, tell me if you think this is creative. When I was five, I imagined that there was such a thing as a unicorn. And this is before I had even heard of one, or seen one. I just drew a picture of a horse that could fly over rainbows, and had a huge spike in its head. And I was five, five years old. Couldnt even talk yet.
 Hey guys, um, you know what, we cannot shoot this ad today.
  How about never hundred hours, sir.
 Hey thanks. Thank you.
 Yeah, Im glad you called. Ryan is being a little bitch again.
 Whats up my brotha? Listen, David, I would like to do this ad in house. I want to use only the creativity that we have right here in the office. And I will send it to you tomorrow morning, take a look at it, and if you do not think that its ready to air, send the ad agency back down here, and well do it on my dime.
 Im willing to stake my entire reputation on it.
 Okay.  And thus, Michael Scott sealed his own destiny. In a good way.
 Has anyone ever come up to you and said, "Youre not creative"?
 Well theyre wrong. You are creative. You are damn creative. Each and every one of you. You are so much more creative than all of the other dry, boring morons that you work with.
 We have three scenes to film, big scenes. We have a song to write. So lets get cracking. Kelly, I want you to do makeup. Oscar, I would like you to do costume design, obviously.  Phyllis, Id like you look around town and see if we have any celebrities in our local area.
 Okay, okay, Phyllis this is what I want you to do. I want you to go down to the mall. I want you to get in line. I want you to get her to be in this commercial. This would be a huge coupe people. All right? Do not take no for an answer.
 Line it up Phyllis.
 Time out, time out, time out, time out, time out. I thought... I was under the impression that this was going to be a rap.
 Okay, Darryl, wow, you need to learn a lot about your own culture. Ill make you a mix.
 Stop. Stop stop stop stop stop stop. This is not me. This is not my music.
 No, I hate it! I hate it! ...I dont hate it, I just dont like it at all. And its terrible.
 Okay, you know what. Hold on, hold on Darryl.
 No. I said I hate the, the style.
 Okay, wow. Wow, this looks uh, terrible.
 Andy, Andy, this is a pivotal scene in the ad. And if we dont get this, if we dont nail it, were going to lose the whole triumph of the moment. The triumph of the will. Now, God, what? What Phyllis?
 Thata girl.
 Did you, or did you not get Sue Grafton?
 Ugh, can somebody give her a tissue please?
 Im about to send the ad to corporate... and it is sent. Theyll probably watch it right away. I know I would. Okay.
 Pam, please clear my phone lines.
 They could call at any second now.  Oh God...I better call.
  Well, its been tough. The uh, geniuses at corporate rejected my commercial and tonight they are airing the brain dead version. So welcome one and all to the world premiere of Corporate Crapfest!
 No, it was stupid. People like waving, waving sells. Its not art. Yet we made our ad, the real one was full of humor, and full of depth, and full heart and it was real.
 That was fun. Next round of drinks is on me, people!
 This is perfect.
 This is a dummy, a la Ferris Buellers Day Off.  We have tied a string to the wrist, which goes to the door.  When somebody opens the door, the hand goes down, hits the remote, turns on the tape recorder, which is me snoring.  Now nobody knows whether I am here, or whether I am gone.
 But, you will not tell anyone.
 Well, sometimes.  Most of the time I will be with Ryan, or Darryl.    Yes?  Oh good, good Stanley!  First victim, this is what I want you to do.  Go out, come back in.  Were going to hide.  I want you to tell me if this looks like me, okay?
 Just go out, and come back in.
 What?
 Hey everyone, can I have your attention please?  I just thought you all should know that Stanley Hudson is planning on leaving us, because our old friend Karen from Utica is going to give him more money to work there.
 No, no, no, no, no-no, no no.  You completely misinterpreted my tone, this is a horrible thing.  Clearly, Karen is trying to get back at us because Jim dumped her.
 Okay, smarty pants, then why?  Why is she trying to take Stanley from us?
 That could not possibly be it.
 You cannot take the hilarious black guy from the office.  Stanley is part of what makes this branch so extraordinary.  The bluesy wisdom, the sassy remarks, the crossword puzzles, the smile, those big watery red eyes.  I dont know how George Bush did it when Colin Powell left, and if Utica thinks that they are going to poach Stanley, they have another thing coming.
 How can I get you to stay?
 Yeah we all want money.  But there is none in the budget, so... Tell me why youre really leaving.
 Mo money mo problems, Stanley.  You of all people should know that.  Let me ask you this, if I were-
 Pssh, kay.
 Fillipellers, hows it hanging?
 To the left?
  To the right?
 Okay, enough small talk, go ahead.
 Yes, listen, um...  You cannot tear Stanley from his family like this.
 No, his work family.  Look, this is very hard for me, but Im going to give you my best man.  You may have Toby.
 You can train him.  Hes very very smart, and funny, and charming... You know, I cant do it, Toby is the worst.  That- that was a bluff, um...  Listen, if you are going to poach one of my guys, Im going to poach one of yours.
 Okay, good-bye.  Wait!  Wait! Karen, could you transfer me to one of your salespeople please?  Your best one?
 Hi Ben, Michael Scott.
 Im going to cut right to the chase here.  Do you like magic?  Because Im a genie in a bottle, and Im going to grant you three wishes.  To move to Scranton, to have a great job, and to be my best friend.
  Get out.  Uh, yeah.  I also saved her life, but I guess thats not as grabby.
 No, I fired them, and your next. ... So what do you say?
 What is that guy talking about?  Scranton is not lame.  Scranton is the cool, fun branch.  Were like Animal House.
 Jim, were getting crapped on.  Word is that our branch sucks, and we have to do something about it.
 What are we going to do?  We are going to make a monster sale, thats what were going to do.  Corcroan dropped Staples.
 Yes they did, oh yes they did, and we are going to murder it.  You, me, Dwight are going to jump into my PT Cruiser, and were going to crush this sale.  Were going to prove, what the hell is that music?
  Thats the problem, thats the problem.  We need rock n roll Pam, rock n roll.  Alright?  Oh... My... God, thats why people are leaving.  I- I have no words.
 What? What? We did?
 Look at his face! Look at his face!
 What are we doing, Dwight, what we are doing?
 We are going on a panty raid to Utica, is what were doing.
 Uh-huh.
 Yes you are.  Oh, buckle up Jim.
 We are going to make Karen wish that she had never been dumped by you.
 In your face
 Are you calling Karen?
 Yep, get it.
 It had to be done, it had to be done.
 Hey Dwight, he found it.
 Alright, youre going to miss the best prank ever.
 Do you really wanna know?
 Follow me, come here.  Heres what we brought, we brought uniforms from the warehouse.  I brought silly string, Dwight brought gasoline and chunks of rubber to make stink bombs.
 No, no, not real bombs.
 Uh, maybe, maybe, I dont know.
 It could be badass.  Yeah, it will.
 Teach her to offer Stanley more money.
 So, why did you and Karen break up?  Was it the sex?
 I cant imagine the sex being bad, I mean her body is...
 ...awesome.
 Okay, I will start.  Um, "A."  "A" my name is Alan, and my wifes name is Alice, we live in Alaska, and we sell...  Damn it! What do we sell?  Um...
 Im trying to think of what we could sell.
 Ah, la, la, la. What is that?  That sound...  The air-conditioning leaking or something?
 What is that?  Dwight, are you peeing?
 Come on man, that is disgusting Dwight!
 Ill kill you man!
 That is just so disgusting!
 Afro wig, do you want the afro wig?
 Yeah, Dwight, heres how its going to go down.  You and I-
 You and I are going to sneak inside and pretend that we are warehouse workers.  And then we will silly string the beejeezus out of the place.
  We are in a stairwell.
 Theres a guy, theres a guy.
  Oh my God, oh my God, that was very close.
 We found something far better, their crown jewel.  Their industrial copier.
 Its enormous, but its got wheels.  Were wheeling it down the hall, into the stairwell.  Get the car ready, keep the engine running.
 Aha!
 Were wedged between the copier and the railing. Ah! Ow! Ow, my leg!  Jim leave us.
 Save yourself!
 Dwight, you gotta move!
 Dwight, could you move over a little bit.
 Take her to a motel, make love to her Jim.
 Just say you wanna get back together.
 It doesnt have to mean anything.  Just, do it for Stanley.  Come on Jim, just climb on top of her and think about Stanley.  Ah, Jim, if this is it for me, promise me something, host the Dundies.
  Dwight.  Granted, maybe this was not the best idea, but at least we care enough about our employees that we are willing to fight for them.  And if you so much as harm a hair on Stanleys head, we will burn Utica to the ground.
 We tried and we failed.  Stanley, you may go.  Here is a box, for your things, but I doubt that that box will be able to contain all the memories that you have of this place.  Fly away sweet little bird, fly away and be free.  Pam, Im gonna need some help writing a want ad.
 Um, wanted middle aged black man with sass.  Big butt, bigger heart.  I cant do this.
 Of course.
 Really?
 Morning.
  Hey, nobody cares. Nobody cares. I need that room at some point, so just, wrap it up.
 Hypothetically, if I were to ask you to go camping, and you know what hypothetical means?  Not real.
 So if I were to hypothetically ask you to go camping with me, would you go?
 Really?
 Oh, you wanna go today?
 How often can you actually donate blood?
 Your body only has a certain amount.
 Yeah, just this whole Toby, camping thing, uh, seems a little lame.
 A bunch of guys, in a tent? Making smores?
 Hello, Im Broken Mountain. You know, heres the thing. Thats not how you go camping. I think you go camping by yourself---
 In the wilderness. Its not with a group of guys frolicking around in tents. Its one guy, or two guys, if your plans change.
 I wanna do it myself. You know, I want to go and, and find out something about myself, I wanna get outta here. All the cliques, and the office politics. Fluorescent lights. Asbestos.
 Im sick of it Jim. Im sick of this place.
 When Jan and I had satellite, we used to watch a reality show called "Survivorman." And, it was interesting because it was about a guy who would go out in the middle of no where and just try not to die, try not to get eaten by an animal, or be overexposed.
 OK, I will only need two things. Roll of duct tape and a knife.
 OK. Thirty minutes or less, please come back. Save the receipts.  Hey, what...
 Hey, hey hey! Dwight. . Dwight.
 Dwight and I are going out. He will return later, but I will not. I will also be taking a personal day tomorrow, and perhaps the next day.
 No.
 Dwight will be driving me deep into the Pennsylvania wilderness.
 Where he will then leave me to either die or to survive. The choice is yours.
 Yes, and I am leaving you in charge of the office for the rest of the day and for the next several days. Do not try to follow me.
 This is a very personal, private experience in the wild, that I wish to share it with me, myself and I.
 When I return, I hope to be a completely changed human being.
 This is what a true survivor man does. You simulate a disaster, like a plane wreck. You could only wear the clothes that you have on, and you could only use the stuff you have in your pockets. Now, in this case, this disaster is a serial killer. Creepy guy whos abducted me and is taking me out into the wilderness to leave me for dead.
 Well, yes I would. And I would survive.
 Well...
 You...
 You... you are as creepy as a real serial killer. For real.  OK.
 I am putting this on so I have no familiarity with my surroundings. Now this way, I cant retrace my steps. I dont know what streets weve been---  Ow! What are you doing?
 No! Gosh! Dwight.  Stop it, stop it! Stop it.
 Just, please allow me to have one cathartic experience in my life?
  Look at those wrinkles. Blacks do crack! Not crack the drug.
  Happy Birthday!
  Happy Birthday!
  Happy Birthday!
 Dwight will take my blindfold off when we are deep in the forest. Just the two of us from this point out.
 What are you doing? Stop. Dwight, Dwight. Just --
 Stop.
 Alright, good. Thank you, Dwight.
 Alright, very good. Ahh, OK.
 Thanks for the ride. OK. Leave me be, Dwight.
  Day One. Im in the interior of the vast Pennsylvania wilderness. Ive brought with me only the bare essentials. A knife, roll of duct tape, in case I need to craft some shelter or make some sort of water vessel. Its hot today. The sun is in the two-thirds easterly quadrant, which would make it about  2 oclock in the afternoon. Its really beating down on me now. I think that I want to get a little more comfortable because the sun is depleting my resources.  OK. OH, there we go. Watch that I dont hit my corroded artery here...
 There we go.  Much better. Now everything I brought with me can be used. My sport coat here, can be fashioned into a backpack of sorts .
 Im going to wear what was once one of my pant legs.
 See, this is a beautiful piece of material  This could be used for all sorts of things.
 Some sort of kerchief to keep my neck nice and comfortable.
 I am totally alone right now, with only my thoughts. I love it. Im loving it. I can literally say anything I want. No one is gonna here me.  Wish I could have gone with Ryan on that cool retreat! Jan has plastic boobs! I HAVE HEMORRHOIDS! Doesnt even matter.
 Well it is a little chillier than I had thought, so I have fashioned my hat back into my pants. Several hours in, time for me to find some nourishment. Now, these woods are full of creatures that can sustain human life. Things like, uh, squirrels, nice juicy rabbit would be delicious.
 I have made this spear, with which I will impale my dinner. And it couldnt come a moment too soon because I have been without food for a good three hours or so. Im startin to feel it a little bit. Ohh... Its Creeds birthday.  Happy Birthday to you. Happy Birthday to you. Happy Birthday to Creed. Happy Birthday to you. Happy birthday, buddy.
 Well if you take a look at this, I tented my pants. Ive made myself a nice pants tent shelter. And this little guy  may be Dunder Mifflin paper some day.
 Under this tree, I think I struck the mother load. Those  are natures best mushrooms. Wild, and I have to say these little buggers are damn tasty as well.
 Yeah!  Alright, skip around the room. Skip around the room. We want -- OK, alright. Yeah, dont do that. Youre gonna break something.
 Man became civilized for a reason. He decided that he liked to have warmth, and clothing, and television, and hamburgers, and to walk upright, and to have a soft futon at the end of the day. He didnt want to have to struggle to survive. I dont need the woods. I have a nice wood desk. I dont need fresh  air, because I have the freshest air around, A.C. And I dont need wide open spaces. Check it out.  I can also make it the sky.
 Hey, buddy.
 What up?
 You are relieved.
 So what did I miss?
 Oh.
 Yeah, okay, I did that. Rookie mistake.
 Uh huh. Yeah, just wait. Ten years, youll figure it out.
 Thats what I said. Thats what she said.
 I never know. I just say it. I say stuff like that, you know, to lighten the tension. When things sort of get hard.
 Hey! Nice. Really good. Bravo, my young ward.
 Ill call back.
  Yeah, um, tell him Ill call him back.
 You cant always work 200 days though.
  Oh, no, no, no, I dont have time for this. Tell him Im in a meeting.
 Yep.
 Oh. Ah, this is a very important client. But, I have the most important client sitting right in front of me, my boss, so I will call him later.
 N-No, money isnt everything Ryan. And youre my friend, and I dont want to be rude.
 I refuse. My house, my rules, I insist.
 Uh, okay, all right. Pam, would you put the call through?  Hi buddy.
 Yeah, I hate that.
 So, heres the deal. Um, I am on my way to New York to be deposed as part of Jans wrongful termination law suit. The company fired her for having the courage to augment her boobs.
 Yes, yes. Pat-tern. Patt-ern. My friend Pat took a turn. Thats how I remember that. Could we pull over and put down the top? Im feeling a little queasy.
 Well-
 Disray .My friend Disray got news specs. Disray spect. My friend Inappro drives a Prius with his behind neighbor.
 Yep. Tell them how much youre gonna get if you win.
 Million dollars!
 Four million dollars! Man that is a lot of guacamole. A lot of the green. Lot of green. That is why I have memorized Jans answers, and I have also thrown in some errs, and ahhs, to make it seem like its not memorized.
 Perfect crime.
 Could we please pull over and pull down the top, I do not feel good.
 Im getting car sick! Ugh, Im gonna puke. I think Im gonna throw up.
 Hey, Schneider, real quick. What do you call a butt load of lawyers driving off a cliff?
 Yeah, a bunch of rich lawyers took the bus.  Where did you find this guy? Hey, there he is.
 Hey hey.
 I would love that.
 Abso-fruitley. Yeah. Ill-Ill do anything for the company.
 It is.
 Hi.  No, no, absolutely not. What is he doing here?
 Are you renewing your divorce vows, before my deposition?
 Never. I want him gone. I dont talk until he leaves.
 Okay. All right.
 Yessh.
 Well, it was not just termination. It was a pattern of disrespect and inappropriate behavior.
 I havent actually seen it. But I have seen the firm, and I am planning on renting The Pelican Brief
 Six years and two months.
 Thats what she said.
 Thats what she said.
 Uh, wh-why would she say that?
 Come again? Thats what she said? I dont know what youre talking about.
 Well, delivery is all wrong. Shes butchering it.
 She thought it had to do with the twins. Thats what I call them.
 Um, to be delicate, they hang off miladys chest. They... make milk.
 Yes.
 Yes, and frankly, the timing was nothing short of predominant.
 Well, if it did, then the company is breaking its own rules.
 Because before we started dating, we disclosed our relationship to HR. And I have the proof right here.
 I will allow it.
 Uh...
 Uh-huh.
 Ugh. Well, de-depends on how you define "begin". I mean, if it was from the first time we shook hands, thats like six years ago. If its from the first time we kissed, thats like two years ago.
 If it was the first time we kissed sober, it was like four months after that.
 Line.
 Jan and I had an off again, on again relationship for two years. And I know this destroys her case, and I am sorry, but I throw myself at the mercy of the deposition.
 Whoa whoa whoa whoa! What are you doing with my diary?
 Irie.
 I dont think anyone in this room has the right to read my diary.
  Can I sit here?
 How can you give up my diary like that?
 Howd you even find it?
 I dont like lump. Im really upset about this.
 Fine. I love you.
 Not a woman, just a cool, great looking, best friend.
 Alright, alright. This is the way I see it. Yes, I had sex with Jan, and yes, I did consider Jan to be my girlfriend. However, Jan clearly didnt consider me to be her boyfriend. So her actions are completely rightful.
 Thank you very much. You didnt have to say that.
