 That was before our relationship. She was going through a divorce, and she was drinking a lot...  ...of water.
 March 17th.
 Yes.
  "I am out of carrots. I am out of sticks. Mr. Scott has time and again proven himself to be an unmanageable employee, and a poor branch manager. I recommend he be removed from that position and re-assigned to sales where he belongs."
||
 How can you do that to me?
 Dunder Mifflin has always treated me with the utmost respect, with loyalty. They were going to give me your job and I should have taken it.
 See? I was his number 1 contender. I was being groomed.
 ...Absolutely not.
 Oh, hey no biggie. Just...
  Hey, David?
 I think youre a nice guy too.
 Why did I do it? I dont know. Jan said that it was because of the photo that she revealed the diary. But she already brought the diary with her to New York, so... You expect to get screwed by your company, but you never expect to get screwed by your girlfriend.
  What do you want to do for dinner?
 Sure trying to save some money... get something cheap.
 Do you fast food?
 Nobody likes to work late, least of all me.  Do you have plans tonight?
 Yes I remember. Mmm, this is B.S. This is B.S. Why are we here? I am going to call corporate. Enough is enough, Im - God, Im so mad!  This is Michael Scott, Scranton, well we dont want to work. No we dont! Its not fair to these people. These people are my friends and I care about them! Were not going to do it!  Everybody I just got off the horn with corporate and basically I told them where they could stick their little overtime assignment. Go enjoy your Friday.
 All right, happy Friday.  Well I think we dodged a bullet there.
 I think we should celebrate. How about you, Pam, mi casa, a little dinner, dancing, drinks?
 You said you didnt have plans. Thats what you said.
 Dwight, its couples only. And besides, I only have six wine glasses, so it will be me and Jan, and Pam and Jim, and Angela and Andy.
 Hello.
 Come on in. Good to see you.
 Yes I would. So, what have you been doing?
 Yeah.
 Well we have been doing pretty much the same thing.
 Except driving.
 Well have a seat, or come on in, or, I dont know, make yourself to home. This is our casa.
 Okay.
 Totally your call babe.
 Oh, just redoing the sliding glass door.
 Well, thats...
 Yep, never been used.
 No.
 This is it, check that out, can you smell that?
 As you can smell theres a lot of different odors going on in here.
 Bond.
 James Bond Fire. I am Bond fire, James Bond Fire. Michael Scarn.
 Guess what, white and eggshell white are exactly the same color.
 Well, I-
 Thanks, thats my bed. Jan has some space issues, so I curl up on that puppy.
 Its actually a lot bigger than it seems. Look at this.
 I finally broke down and bought myself a plasma TV. Check it out.  I actually hung this on the wall myself. I want to show you something . A lot of people in the room, need more space?  Voila, right in the wall.
 Sometimes I will just stand here and watch television for hours. I love it, I love this TV. Oh and I also built this table.
 No, I think that is either pine, or nordic cherry.
 If you ever need any help, I am just a phone call away.
 Oh honey, I have the best trophy right here, aside from my Dundies.
 Ill get it.
 Okay.
 Very nice.
 When in Rome.
 Whatever you say babe.
 All right.
 How bout a toast. Shall I? Heres to good friends.
 Kinda sorta an oaky afterbirth.
 Yeah that sounds good.
 You know what, Hunter was a terrible assistant, that is why Ryan fired him.
 All right,  my my my my turn, my my my my turn, my my my my turn.
 Yes, I was watching Jims face.
 And he was laughing.
 Look at him, hes laughing.
 Well you dont need two of you to do that.
 Thats true, thats a great point. Come on down here. Sit down on that couch and be amongst friends and we are not going to think about all your stuff being destroyed, all right.
 All right here we go, this is going to be fun, ready. All right first name is Tom-
 All right, Okay, okay, youre getting inside my head. First name is blank and he goes on a cruise, he goes on a Caribbean CRUISE.
 No, Baah! But hes married to her!
 No! It has to be a real person Jim, come on. Okay, no no, Im gonna pass, Im gonna pass. Okay, rhymes with Parnold Schporzenegger.
 Okay, he is the governor of California, he is the Terminator.
 No!
 God, does anybody read the paper?!
 Youre welcome.
 I dont like that story babe.
 Stop, stop it! I mean, I like ice cream. Okay? Sue me. Oh, no, dont. I shouldnt say that jokingly because she will sue me. She loves to sue, loves lawsuits. You know honey, that door was extremely clean and it looked invisible.
 Ha ha, you are! She is! She is the devil! Im in hell! Aaahhh Im burning, help me!
  So I spend most of my time right here. Have a hand . So Jim I noticed you checking out Jans candles.
 Yeah, did you know that candles are the number one fastest-growing product in the scent aroma market? $2 billion dollar a year industry. And for only $10,000, you could become a co-owner of "Serenity by Jan" What do you think about that?
 Im sorry.  What now?
 Dwight is my friend.
 You said that I could not invite Dwight because he was not part of a couple, and because we didnt have enough wine glasses. Dwight brought glasses and a person.
 Whatever I want? Its never whatever I want. When I wanted to see Stomp, and you wanted to see Wicked, what did we see?
 When I said that I wanted to have kids, and you said, you wanted me to have a vasectomy, what did I do? And then when you said that you might want to have kids and I wasnt so sure, Who had the vasectomy reversed? And then when you said you defintely didnt want to have kids, who had it reversed back? Snip snap! Snip snap! Snip snap! I did. You have no idea the physical toll, that three vasectomies have on a person. And I bought this condo to fill with children.
 Do you mean it? You want to have a kid?
  Pam... I hope she didnt do anything to the food.
 I cant prove it but I think she might be trying to poison me.  Hey, looks great babe.
 You know I have soft teeth, how can you say that?
 Excuse me for a second.
 Ok... alright... here we go.  There.  Oooookay.
 Everybody enjoying their meal?
 Yeah?
 No. No. Im gonna leave it up. I think it ties the whole room together.
  Jan thinks Hunter is very talented. You know what? I dont think hes that good.
 BFD. Im a screenwriter.
 NO ALL YOU DO IS YOU GET ME TO TRY TO WORK ON MY RICH FRIENDS!
 MAN! I WOULD LOVE TO BURN YOUR CANDLES!
 OH GOOD. ILL BE YOUR FIRST CUSTOMER!
  THATS WHAT SHE SAID!  THAT IS A 200 DOLLAR PLASMA SCREEN TV YOU JUST KILLED! Good luck paying me back on your zero dollars a year salary plus benefits, babe!
 You know what guys, shell be out of the bathroom soon.
 Nope. Nope. Nothing disturbing here. Just a couple of friends having an awesome dinner party.
 Oh... yes. There was some screaming but... um... my girlfriend... threw a dundie at my TV. Plasma.
 Would she get into trouble?
 I will take the fall. I did it.
 Jim? Pam?
 No.
 Nope.
 Pam, when I first opened this catalog, I thought I was just going to be picking out a chair.
  Have you ever seen this woman?
 Hmm...
 Look at her smile. Those eyes, look at her eyes. Shes got - I dont know what it is actually, she dresses like a professional and yet you know there is a side of her that could just curl up on a couch.
 Oh, yeah, maybe, but remember after my dinner party when I said that I was swearing off women?
 I think what I meant was that I was completely swearing off one woman.  Jan. I think that fate put this catalog in my hands.
 What is it like being single? I like it. I like starting each day with a sense of possibility. And Im optimistic because every day I get a little more desperate and desperate situations yield the quickest results.
 Ladies and gentleman, would you please open your supply catalogs and kindly turn to page 85.
 I am ready to start dating again. Getting back on the market. So, FYI, for those of you who are thinking about fixing me up with any of your friends, use the woman on page 85 as a template. That will be all.
  Listen man, I am completely over Jan, so, would you set me up?
 I thought that you were engaged?
 Whaaaat? God, thats terrible man. Eghh, shes crazy. Umm, are you still on good terms with any of her friends?
 Oh...
 Yeah... ugh. Shes...  you dont deserve her. Alright.
  Oh hello Oscar Mayer Weiner lover. I bet that you have a bunch of very liberal girl type friends that trust you implicitly because they know youd never touch em, because of your condition. Umm...
 What?
 Oh.
 Hmm, I see, feisty. So shes not jolly or sassy? Not like a jolly, sassy opera singer?
 Oooo. Catcher or in field?
 Is she a dress wearer or a pants wearer? Could we share a row boat? Could, could a row boat support her?
 I think Im being very clear what Im asking. Would an average size row boat support her without capsizing?  It bothers me that youre not answering the question.
 Damn it, I knew it! I knew it Phyllis! OK!
 What is wrong with these people? I would do anything for them and theyre just hanging me out to dry.
 Dating shouldnt be hard for somebody like me, but it is and you know why? Because nobody here is willing to help me. Nothing would ever get done in this office without a formal request, would it? Well, fine. Here goes.
 Well, now OK, I know that this is probably not appropriate, but I need help. Because I want to play ball with my kids before I get too old. And before that happens I need to get laid. And before that happens I need to be in love. And I dont wanna hear "Ahnnn... I cant help elhh la la." No. No. Im a catch and I am not going to be the one who got away. So, this is what were going to do. Dwight is going to hand out index cards and I want you all to write down the name of an eligible woman for me to date by the end of the day. No, by the end of the hour or you are fired.
 Hmm..
 Well, look, I am in an assigned parking place in front, so... Alright, alright, alright, umm let me try to think about what it would be like to not have one.  OK, yes that would be bad.
 That would be bad.
 Wish I could, but I cant. Well can, but wont. Should, maybe, but shornt.
 What part of shornt dont you understand, Kevin? Look I could probably handle it, yes, but I think it would be a good exercise for you guys to do it yourselves.
 Oh you cant because I dont care. Listen,  dont forget to fill out those cards. My love cards.
 Ok, Wendy. Hot and juicy red head. Give this a try.
 Hello Wendy, this is Kevins friend, Michael.
 Oh, Im sorry, could you put her on please?
  Damn it Kevin. OK, umm, could I just have a frosty and a baked potato please?
 Well, Ill send somebody to come pick it up. Just have it ready.
 Well put it aside.   Umm... yeah.
 Good. Good because this batch was awful. Umm... this one says chair model...
 That sounds good.  Go get her. Wa-Wait, wait, wait, wait. First, go to Wendys, get my food. Come back and then go.
 Shes dead?  Shes so young.
 Oh, God. Oh...
 Try not to be so hurtful Jim.
 Please, not at a time like this.
 Oh really? Whats her name? Burger King?
  I dont, I dont think Im ready. Is she hot?
 No question about it, I am ready to get hurt again.
  No, not the five families.
  Sorry, I dont have time for this right now. Im trying to get a date with Pams hot friend. And she needs to meet me right now.
  Thank you very much. Our suspect has straight brown hair. She is wearing blue jeans and a black top. So... behold our bachelorette . Give her ten for looks and a three for her ability to describe herself. Hello, my lady.
  Ugh.
 Is who a Michael what?
 Oh, thats not, yeah Im not... OK...
 So you get the rent checks every month and what happens next? What...
 Just making conversation.
 Why is it so hard to meet people? I... you know... its uh... All I want is somebody nice and sweet and someone I can talk to and share an experience with, you know? Why is it so hard for people like us?
 You wanna see what I walked out on? This is gonna blow your mind.  Look at that.
 Yeah. Yeah, and you cant see her whole body. Down here, shes got a boob job. Just... she was just crazy smart and really manipulative and I dont know.
 Oh, OK. Well, umm... I enjoyed this conversation. It was very nice. It was like talking to the sweet old lady on the bus.
 Now you ruined it.
 Margaret the land lady? Really Pam, is that what you think of me?
 Oh, OK, Well Im looking for a passionate affair, not companionship. Im a man... of intensity, of, of cool and youth and, and passionately. God...
 I dont know man. I was with Jan for so long. I was excited about meeting somebody new. Put my heart out there. Its just...
 Youre right. What do you mean though?
 Hmm.
  How did she die?
 God.
 She was so innocent.
 You know I used to think that I had this perfect person out there waiting for me, but knowing that, thats just silly because shes dead. What do you do?
 Oh, you move on.
  Bye, bye, Ms. Chair Model lady. I dreamt that we were married and you treated me nice. We had lots of kids...drinking whiskey and rye, oh whyd you have to go off and die? Whyd you have to go off  and die?
 Return.
 Thisll be  the day that I died.
 I got gum in my hair.
 This just stinks. Dont touch it, please dont touch it.
 OK, let me be.
 I was walking in and I noticed something shinny under Stanleys car and I got under to see what it was and I messed up my hair, all for a stupid piece of tinfoil.
 Kill me... right now.
 I dont feel like peanut butter. Get me an ice cream sandwich.
 Hey, hey, hey. This is my hair were talking about.
 Smells good.
 Oh dont. Thats disgusting.
 Well just dont leave it on too long. Keep massaging please. Ah yeah, thats nice.
||
  I will be honest; the dating has not been going well. Look, men are visual creatures. We crave beauty, like a piece of fine art by any number of renowned artists, or an arty photograph of Cindy Crawford nude... that, but the women Im getting fixed up with are, egh! Not that they arent nice, or that have great personalities, they just... They just lack a certain... Crawfordness.
 Ladies and Gentlemen, may I have your attention please. I know that a lot of you are very angry with Ryan because he is the reason we all have to come in tomorrow, however, I swear to God, If any of you hurts him in any way emotionally or taunts him or makes fun of his height or his half beard or...
 Yeah.
  Ryan has done a very good job, and I am not applauding sarcastically. Think about it, a month ago nobody would go on this site because we were worried about getting molested, or losing our identity, having it stolen. But now, at a time TDB, all of the problems will be in the past. Ya done good kid, ya done good.
 Well it has been nice seeing you again my friend.
 Oh Ryan, I need a girlfriend so bad.
 Argh. Alright. Do you know any girls in New York you might want to hook me up with? Some that might be interested in a guy like me.
 Na?
 Well you tried.
 Yeah.
 They sound great.
 Would you have sex with Meredith?
 Do you think shed keep it quiet?
 Jim, its not the horniness, ok its the loneliness that...
 Lets go to New York. Well go clubbing with Ryan.
 Yes you can, youre single, Im single. Itll be awesome.
 Who you dating?
 Thats still going on?
 Ok, Dwight grab your stuff, were going to New York to party with Ryan and to meet girls.
 Sorry Andy. Cannot take any chances on curses, not tonight. Lets go. Everybody, I will see you tomorrow, Saturday morning, probably wearing the same clothes that I am wearing right now, If you catch my drift.
 I am going to go get laid. Goodbye.
 Thats... I, I think that...
 Ryans assistant told us that he would be at this club this evening. It is called Prerogative.
 Place is packed.
 Packed with beautiful babies. Swingers. Classic. John Favreau, tall guy from DodgeBall.
 No, theyre just hotties.
 Hey.
 Hey!
 Well you know, just taking you up on your offer to party, so tada.
 Alright!
 Yeah.
 Ryan, its Michael and Dwight.
 Ok.
 Well.
 Alright!
 Lets do it!
 Hey, nice to meet you.
 Oh ok, all I know is I would like some chicken fingers and a Midori Sour.
 Oh ok, then just bring me two cups, one with olives and another filled with maraschino cherries.
 I umm, thought about getting a tattoo on my back as well at one point. I was thinking about getting "Back to the Future."  "Back" because its on my back and "Future" because Im the kind of guy who likes to look ahead into the future. I just think a tattoo should mean something, you know? And its my second favorite movie.
 Back to the Future?  Oh, wow. Well you should take a, a film education course.
 Forty... Im in my forties.
 Nuhh...
 Oh, OK.
 You are welcome.
 This place is like sexy pre-school.
 I would love a place where we could meet older
 Ahh, wow. Thats dangerous.
 Youre kidding.
 Ive never met anyone who does that. You wash dogs? Very cool.
 I am a bank teller.
 Ryan told me to always tell women you work in finance.
 I think so.
 Yeah, I have fun.
 All right.
 Very perfect.  Oh my  This needs to be shared.
 She washes dogs.
 I know. I dont wanna get ahead of myself, but I think I want her to meet my mom.
 Yeah, maybe.
 Hmm...
  I am. I am getting out there. Well, no Ive asked a lot of girls to dance mom. Theyre just, its not...  Yes, I shaved above my neck. Oh my God, mom, I gotta go. One of my friends is getting beaten up by some girls.
  Those girls really wailed on you bad.
 Well...
 Pretty weird.
 Lets go.
 I know, here we go.
 This is it.
 This is where the magic happens.
 Very nice.
 Dwight, Im the boss.
 Case anyone needs to go to the bathroom in the middle of the night, I dont wannna get my head stepped on.
 Dwight, shh shh. Dwight. Leave him alone.
 Shh. Ryan, Ryan, were going to take your clothes off.
 Shh, just stop. Heres what you do. You tell him that youre his friend and that youre gonna help him and that everyones gonna be all right. And then you put a wire on him and you find out whos selling him drugs and then you get that guy and you flip up, turn him into a snitch. You follow that guy to the people whos really really bad. Been watching The Wire recently. I dont understand a word of it.
 Best night ever.
 Like I said, its not about the horniness, its about the loneliness. And how can I be lonely with my boys? Like a famous person once said, Boys on the side. But I dont, I disagree, I say... lets hear it for the boys.
 Everybody! Everybody! Listen up, I need your ideas, now! Ideas please, right now! Go! Go! Come on!
 Wet cement, outside. Its drying fast, come on. This is a lifelong dream. What do I write? What do I write?
 M.G.S.? No. Some idiot named Mark Greg Sputnik will claim credit for it. I dont...
 Once in a lifetime opportunity people! Come on, here we go!
 Here we go!
 Lets, yes?
 Okay... Okay, do it! Go on! Great! Lets hear it!
 Its drying, its drying...
 Alright, hablbelah, come on, Phyl!
 Ahh come on!
 No!
 No!
 No!! Come on, gimme something good!
 Pam, translate.
 I love it!
 I love it more!
 I... love it!! Haha, come on!
  Hurry, please.
  Thats what she said.
 Today is a very special day for me. And its really not about me, its about my grandkids, its about my great grandkids... I can come back here when Im 100, and I can find that piece of cement and say, "Thats me. Look kids, your daddy left that face hole..." I dunno, its a good feeling.
 All right, everybody... Oh my God, Pam, those make you look so ugly. Um, Pam, in order to get hotter, you take the glasses off. Youre moving in the wrong direction...
 Ub, dub dah, dont need, I cant even hear you. Its just noise coming out of an ugly scientist. Um, everybody, were going to have a little brainstorming session in the conference room.
 Ener-gize...
 Everybody, so how are we going to energize our office? I mean, I havent done anything since Christmas. Pam, clearly, has just given up trying. So what we need to do is we get things going, we need to get percolating a little bit. Anybody have any ideas of what we could do. Any suggestions? Yes, Andy?
 Zing and pep, see thats those are the kind of words were looking for. Yes, Jim?
 Now were cooking. I like this. Maybe a whole theme, like a rap. A rap rhyme...
 An urban, yeah, Stanley? You wanna help us out with that?... Stanley, earth to Stanley...
 Yes you. Come on, Stanley, put your little game down and join the group.
 Stanley, were havin a little...
 Were havin a little brainstorm session...
 ...Good, this is good. Im going to grab a glass of water.
 Ugh, what?
 What are you blabbering about? Nothing happened.
 That? In the conference room?
 We were joshin around, the two of us, and he said "did I stutter," and I said "wha-wha-wha-wha-what, dawg?" It was joking, Toby, alright?
 Well you dont get it, because Stanley is a beautiful, sassy, powerful black man, and youre... you. If you had any friends, you would understand. Friends joke with one another "Hey um, youre poor." "Well hey, youre mamas dead." Thats what friends do. Its... youre so white.
 Mmhmm.
 Okay, I will... Im not feeling very well right now though. My stomach hurts, so I may be going home early today, but...
 Well sometimes my stomach hurts when you come into my office, so its probably psychological.
 I, uh, see that you... gave me that form that I asked you to give me, Stanley the manly, so thank you for that. I guess we are back to normal.
 Well, you know, uh, the thing that you said earlier, that you didnt mean, um, and that I forgive you for. The whole things silly, isnt it? Friends dont need to apologize to friends as far as Im concerned, so we are cool.
 Uh huh...
 Great
 Whats the pink?
 Ok... Is there anybody up here, anybody at all, that can deal with this?
 Other than me.
 I never said you could do that.
 I...
 Okay, I will think about it.
 No.
 Hey.
 Darryl,  have you ever been in a gang?
 Its an advice question, and if you dont wanna talk about it, I completely understand. Its, um...
 I know, its very, very personal...
 I knew it. Okay, who we talking about here? Crips? Bloods?
 God.
 Okay.
 Okay, so dig this youre on the street, and one of your gang disses you.
 Yeah, right, so what do you do to get them to make it right?
 What is that?
 Really?
 I wouldve never thought that gangs would be tickling each other.
 Okay, everybody, shh! So, earlier today, Stanley sassed me, and Toby gave me some suggestions on how to discipline him. They did not work, obviously, because they were stupid, so I am now going to fake fire him.
 Its like a mock execution.
 Yes it is a good idea. Its the only possible solution I have left.
 No, okay... Ive had enough of you.
 Because I want you to behave as if Im actually firing him, Oscar, okay?
 Im not firing him. Im not, I need you to act like I am firing him. Just, what Im going to do, is Im going to pretend that I am firing him, and I need you to act like I am firing him. Do you get that? Do you get it? Im teaching him a lesson. He needs to learn humility, alright? Thats all Im, okay, here he comes. Lets just... play act.  Stanley, may I talk to you for a second?
 Stanley Hudson, you are fired.
 I am serious, we are all serious. You are fired like a heart attack.
 Hmm.
 Alright alright, okay, you know what? Now you know how I feel. This was a fake firing. Lesson learned. Good work, everybody. Very nice.
 Thats it. And uh... do you have anything to say to me?
 Okay...
 Yes.
 Thats not-
 All right, all right...
 Okay.
 Hey, STOP IT! Okay, everybody out.
 Everybody, except Stanley.
  I dont understand why you keep picking on me.
 You just, do, and I dont know why, so... please help me understand.
 Well Stanley, maybe youre feeling that you dont respect me because you dont know me very well.
 All right, you dont respect me. I accept that. But listen to me, you cant talk to me that way in this office, you just cant. I am your boss. Cant allow it.
 I am good person, and sometimes, good people dont get no respect. Rodney Dangerfield.  Hey, I dont get no respect. No respect at all. When I was in the sandbox as a kid, I got not respect. My wife likes to talk after sex, so she called me from a hotel room, and said, "I dont respect you!" Ahh, thoughtless. Aw, you know what dont get no respect? Airplane food. Why dont they just make the plane out of the airline food? My wife dont get no respect, some--take her, please, for example.  If you dont get no respect, you might be redneck.  Respect is niiice. Borat.  Whats the deal with Grapenuts? No grapes, no nuts. I dont get no respect!
 So Im thinking, as a reward for our loyal clients, that we contact their assistants, and we find out where they live. And then, we go to their houses, in the middle of the summer, and go caroling. It is a summer Christmas sale-abration. And we call it, a summer sales-a-lot. Feedback? Anybody? Stanley?
 Dammit, Phyllis. Alright, everybody out except Phyllis.
 Hey. Ready? Come on, show me excited!
 Yeah, Im pretty excited too.
 Today Im heading over to the job fair at Valley View High School, to find some new interns. Want to get some fresh blood. Um, euthanize this place.
 Yup.
 Why are you dressed like that?
 Like youre applying for a loan.
 Okay, heres what were going to do Im going to instruct the kids about management and sales. Oscar will be in charge of accounting. Pam will be eye candy. No... uh, also, because that is your alma mater. Darryl will hire some kids for the warehouse. We dont have to worry about internships with them, because they definitely aint going to college.
 Lets go!
  A little over the top, dont you think?
 This is all we need.
