 Dwight, dont! He is an idiot. The man is an idiot, ladies and gentlemen.
 I didnt say it to him. I said it about him.
  How long does it take to find a cell phone? I dont know either.
 Seriously, where the hell is Dwight? Hey, call my cell phone. Itll make it easier for him to find.
 I gave it to you in the car.
 I saw you program it in.
 Okay. Alright.
 Uh, I better tell somebody.  Excuse me, sir...
 Dwight!? Great goin. God, Man! Why did you go in there? What... Everybody was scared out of their wits, man? Oooh.
 Wow. Okay. Well, I guess they dont teach how to operate a toaster oven in business school.
 Hey, did you miss that day there, Ryan?
 Toaster Oven 101?
 Hey! I know whatll impress everybody, Ill start a fire. Oh, man. Bad idea. Bad idea jeans.
  ...since the world was turning.
 Okay. Rule five - safety first,  i.e. dont burn the building down. Okay? That should be a no brainer.
 Oh... look! Ryan is book smart. And I am street smart. And book smart.
 Ill give you the rest of the ten tomorrow.
 Happy Halloween, everyone!  Oh... thats great!
 Ohh... OK.
 I know why shes calling. Its the end of the month, and I was supposed to let somebody go by the end of the month.  And somehow Im supposed to put on a costume and smile.  Okay.
 Hey, Sherri. Michael Scott returning.
 Well, Im gonna wait till the end of the day. Because the book said its best to wait till the end of the day.
 I dont know... yet. I will have to call her back.
 Okay... Sherri?
 If you were getting fired, how would you wanna be told so you could still be friends with the person firing you?
 Thanks.
 Ill call her back.  Wish I could fire Sherri.
 Okay! Im sorry.
 No?
 Bye.
 I mean you hear about layoffs in the news, but when you actually have to do it yourself, it is heavy stuff. Its... these are peoples lives youre talking about.
 Yes.
 Yes.
 Yeeesh.
 Um, Pam, I have to let somebody go today. This is, uh, the hardest thing Ive ever had to do.
 Because its very scary stuff.
 Youre worried about the party? Theres a mans life at stake here.
 No. Or a woman. A human life. If you had to guess, who it would be based on their job performance... and who you think deserved to be fired - who would that be?
 And... sometimes you just let it go to voicemail.
 I know. I sent away for it in July from a catalog.
 Oh, man. Okay, I have to fire somebody.
 Hey.
 You guys excited about the party?
 Its gonna be fun.
  Oh, boy... look at you! Haha. Showing your colors. Bet you wish you wore a dress every day.
 All good. Happy Halloween. What happened to all those spooky decorations that we had? The cobwebs and such?
 Well, you know what? Go buy some more. Ill approve the overages. Sound good?
 Good.  Oh, yeah, also about budget stuff. Um, Im  going to need you to find, like a, a full employee salary, plus benefits, like fifty grand. Im going to need you to find 50 grand in the numbers.
 Well, thats not what Im saying. Just, you know, find it. Pretend that your jobs depend on it.
 Mmm-hm-hmm. Interesting take on Dorothy. I love it. Hey, you know what would even be better? Soccer ball and cleats.
 "Bend It Like Beckham."
  Yeah. That would be perfect.
 Well, I dont really have two heads. So...
 Who do you think it should be?
 No, Jim brings in money.
 Eh.
 Its not a popularity contest. Although it does make sense to fire the least popular because it has the least effect on morale.
  What? There was someone left off that list? Who?
 Youre right, I didnt even think of him.
 Yeah, thats actually a really good idea.
 Yeah... I could.
 Im not saying thats what he said.
  What?
 That is not a very nice thing to say about him.
 Are you kidding?
 I agree. Hed land on his feet.
 So. How did it go with Stanley? How... howd he take it?
 Ahh, come on.
 I dont wanna fire Stanley. I never said that. Im certainly not going to do it myself. Get those big, baleful, eyes staring at me. Yikes. Just, okay, just...
 Oh, God.
 Fantastic!
 What?! That wouldve solved all my problems.
  Oh, you idiot.
 If you left, I wouldnt have to fire anybody.
 Big deal. Oh, it wouldve worked out so well. Can you get it back?
 You can call. Can you call em?
 Wohahah! Why are you torturing me?! God.
  Can I speak to you a minute?
 Help. Me.
 I want you to role play firing me. I want you to fire me, and I will take it.
 Yes.
 I want you to be me, and I will be Creed.
 No, no, no. Thats just the first thing... came... in head.
 Yes, thats a good idea.
 Aaaahh! Im gonna kill myself!
 Im going to kill myself, and its your fault!
 Corporate is really breathing down my neck. And theyre saying this has to be done by the end of the month.
 I... this is Creed.
 Im improvising, so just try to keep up.
 And Im very angry, and I want...
 Im gonna kill you. Im going to kill you for firing me.
 Get off, get off. No, no. OK.. just get off. Just, just... yeah.
 Uh, hey... Creed?
 Could I talk to you for a second?
 You are great. Very ambitious. And I feel like you want more than this little office has to offer. And I understand that youd wanna just spread your wings, and fly the coop.
 I... were gonna have to... You... you want something better.
 No, you wanna leave.
 Why... why are you making this so hard?
 I think youre right.
 No, of course  you cant go. We havent even started this horrible process of... okay, Creed. I need to let somebody go today. They told me I need to let somebody go. And as much as I think youre a great guy, and I like you, youre... youre, goodbye.
 Hmm?
 What old days? What are you talking about?
 Its right here on the desk, yeah.
 I cant, I cant...
 I cant change anything. This is the way...
 I dont... okay, just listen.
 Dont...
 Yeah, I went hunting once. Shot the deer in the leg, had to kill it with a shovel. Took about an hour. Why do you ask?
 I have to fire someone today, okay?
 Okay, well... I already picked you. And you know that. So, unless I just go through with this, youre always gonna look at me as the guy who almost fired you.
 Dont...
 Devon, could I talk to you for a sec?
 Well, he...
 Well, maybe I did.
 Huh. No! I cant, no. I cant go back. I would look like an idiot.
 No.
 No. It was all the stuff that I said. It was the business downturn, the cutbacks, and, and...
 I just hope that you and I can remain friends.
 Devon, wait, please.
 Look, look. In addition to severance, and everything, I want to give you this gift certificate to Chilis. From me. Okay? No hard feelings.
 I  love Halloween. You know, its just, its just fun. Every year, its just fun. Last Halloween I came as Janet Jacksons boob. It was topical. People got a... a big kick out of it. The year before that, I came as Monica Lewinsky, and I wore a stained dress. The year before that, I also came as Monica Lewinsky. And before that, I was O.J. It was pretty funny. Oh, I wish you were here last year.
 He... Hey, hey, hey, hey! How you doing? Wow! You guys looks great.
 You look great! And youre a princess?
 A fairy princess. Youre very... .
 Youre a lion.  Wow, I want to hear your, your... Oh!  Oh, okay, thats all yours. Thats all yours. Grab it, grab it. You know what? You guys are getting all of these.
  I dont want to work, I just want to bang on this mug all day.
 Uhh, yes, I did, heres the dizzle. I have a very top secret mission for you. I want you to update all the emergency contact information.
  Hello, oh God, busy work. Ahh, get away, cretin.
 Yes, thank you. I know where to sign.
 Last year they were out of order, werent they Pam?
 Chillax, Pam. Stop Pam-M-S-ing. Thats pretty good. Um, actually, Im sending Ryan on a top secret mission. Tell her what it is.
 Is it a priority? Oh I dont know, um, what if there is a tornado, Pam? Peoples legs are crushed under rubble. "Please, would you be so kind as to call my wife? No, I cant because we dont have any emergency contact information because Pam said it wasnt a priority." Think. Think with your head, Pam. Ok, well. She walks out. Thats the problem with being a boss is that when you are tough they resent you and when you are cool they walk all over you.
 Catch-22. Yes. Why dont you give me your contact information to start with, ok, whats your cell?
  Hey Ryan. This is Michael Jackson calling from Wonderland.
 This is Tito.
 Calling from...
  Pick up.
  This is Mike Tyson.
 And this is more a ying-yang thing. The Michael all cursive, the Scott all caps. Left brain, right brain. Or, duality of man.
 Yeah, yeah, I dont think that would happen.
 Because I would kick his ass.
 So? Ive beaten up black belts.
 They told me. After. You see, I used to run with a very tough crowd. Street Fighter types. Real, real bad people, Im just lucky I got out.
 And after that, nobody ever messed with the Damn Rascals ever again.
 You were a Jet?
 Yes, in theory, I have. I just need to cross some ts and dot some is. Alright, Im going to be in my office if anybody needs me.  Hoo-hah. Oh, wow, sleeper hold. Thats my rebuttal. Shhh. Hoo. You are the weakest link.
 Im friends with everybody in this office. Were all best friends - I love everybody here. But sometimes your best friends start coming into work late, and start having dentist appointments that arent dentist appointments. And thats when it is nice to let them know that you can beat them up.
 Just hit me. Youll see.
 Oh, queer...  eye. Queer eye. Thats a good show. Important show. Go ahead. Do it.
 Oh yeah, that would be kind of worthless because I know a ton of fourteen year old girls who can kick his ass.
 Look, Dwight is a wuss. When we rented Armageddon...
 ... he cried at the end of it. He did.
 Oh, Bruce Willis. Are they going to leave him on the asteroid?
 Ok, here we go. Alright, come on.
 Fuuuaaaahhhhh... oohhhhh!
 Yeah.  Thank you.
  Go away.
 I havent signed them, ok?
 Come in. Um, Pam, I hate to break this to you but Dwight cant stop you from being mugged. Hes just not tough enough.
 Oh, I could beat up Dwight. Thats ridiculous. I could murder him.
 Oh, so thats what they are saying?
 Ok, alright, where is Dwight?
 Ok.
 Watch out Kelly, he might sucker punch you.
 No, Really?
 Really? Well, the offer, Dwight, was for one punch which I absorbed. I had no idea that there would be a second punch. So, catch-22.
 Look, if we were in a bar right now, there would be two punches me punching you and you hitting the floor.
 Really?
 You know what? Youre just lucky that we are at work right now.
 No, they must have class.
 Look...
 Hey, Toby.
 Ive got an idea why dont you leave right now. Why dont you walk away from the room, kay? Fine. Well go at lunch. Pam, make an announcement. Figure out carpools.
 I recognize that. That is Japanese for California Roll.
 I think it is. A guy told me about that.
 Oh.
 Alotta rules. Alotta rules. On the street we didnt have any rules. Maybe one - no kicks to the groin, home for dinner.
 Hey!
 What the hell was that?
 No.
 Alright, thats the way you want it.
 Play dirty, huh? Ok, game on, man.
 Im comin atcha man. Ok, purple belt, ok. I got him.
 I got his pants.
 Dwight, you have... No, you have something... God, you look like such an idiot!
 Go on, I dare you to kick there again. Kick there again, I dare ya.
 You cant see. You cant see. Good boy. Good boy. Great boy. Two points, three points, four points. I win. I win.  Eight points. Nine points.
 Open your mouth.
 You talkin to me? You talkin to me? "Raging Bull." Pacino. Oh, I want that footage. I want it. I need it. Ah, I have to get back to work. I have lots of work... Oh, oh check this out. Come here.  There he is. Mr. Temp. Having lunch by the car. Let us play with him. Thisll be hilarious.  Oh, were playing phone tag.
 My emergency contact is Todd Packer. Todd F. Packer. Do you know what the F. stands for?
  Yeah... uh, come in. Oh, hey Karate Kid. The Hillary Swank version. Hi. How are ya?
 He is such a sore loser. You heard, obviously, that I mopped the floor with him this afternoon. You know what, um, do yourself a favor and just keep me as his contact and I will call the hospital. Cut out the middle man.
  Yeah.
 Yeah, just throw them on the chair. Ill take it from here. So, whatcha up to this weekend?
 If youre doing anything crazy, give me a shout.
 Alright, bye.
 Dwight?
 This close. Dwight, may I speak with you for a minute?
 Well,  busier. Making the time.
 Well, you dont even have anyone to go home to, Toby.
 I know, but Ive been carrying the load on my back all day, and if everybody would just chip in a little bit, itd might help me out. What do you say? Lets gangbang this thing and go home. Good? Dwight.
 I have been testing you the entire day. Did you know that?
 And I am happy to say that you have passed. So effective immediately I am promoting you from Assistant to the Regional Manager to Assistant Regional Manager.
 I know, I know, I know, I wouldnt be offering it if I didnt think you could handle it.
 No, no, title change only.
 No, no. Three month probationary period. Lets not tell anybody about this right now.
 Absolutely but not really.
 Yes you do.
 And, ditto.
 I told Dwight that there is honor in losing. Which, as we all know, is completely ridiculous, but there is, however, honor in making a loser feel better which is what I just did for Dwight. Would I rather be feared or loved? Um, easy. Both. I want people to be afraid of how much they love me. And I think I proved that today at the dojo.
 Wow, graphs and charts, somebodys really been doing their homework.  Looks like USA Today.
 I changed it.  To Chilis.
 Radisson just gives out this vibe, "Oh, Im doing business at the Radisson".  Its kind of snooty.  So.
 Heres the thing. Chilis is the new golf course.  Its where business happens.  Small Businessman Magazine.
 It will.  I sent it in.  Letter to the editor.
 Uh huh, uh huh.  Power trip.
 Ok, lets do this thing.   Wish us luck.
  Kiss ass.  Ok, probably going to go late tonight.  Burning the midnight tequila.  So, I think you could all just take off now.
 Well...
 No, no.  That would not be efficient.  Actually, they just dont get very much work done when Im not here.   Thats not true.  I know how to delegate, and they do more work done when Im not here.  Not more.  The same amount of work is done, whether I am here or not.   Hey, everybody, listen up.  This is what were gonna do.  You sit tight, until I return.  Sound good?  Doesnt matter, its an order.  Follow it blindly, mwahahaha, ok?  Alright, ciao.   Adios!
 Uh, Ill drive.
 Its just a couple blocks away, so... boy, you really dont know Scranton, do you?
 At all!
 You ever been to Scranton, Jan? Dar de-
 Dar de dar.
 Jan Levinson-Gould.  Jan is cold.  If she was sitting across from you on a train and she wasnt moving, you might think she was dead.
 We should come up with a signal of some sort.
 Well, in case one of us gets into trouble, the other one can signal-
 Well, I... it could be either of us.
 Yeees.
 Hello?  Christian?
 Thought that was you.  Hi.  Michael Scott.  This is Jan Levinson-Gould.
 No Gould?
 Uh, Jan, what happened?
 Is Gould dead?  What uh-
 Wow, youre kidding me!  Do you wanna talk about?
 When did this happen?
 Ok.
 Alright, after you.
||
 Awesome blossom.
  I think we should share an Awesome Blossom, what do you say?   They are awesome. Want to, Christian, blossom?
 Ok, its done. Actually,  Megan, may we have an Awesome Blossom, please, extra awesome?  Now its done.
 I heard a-
 Very very funny joke the other day.  Wanna hear it?
 Ok.
 Just one joke.  Ok.  Well, if its just gonna be one, I will think of a different joke.  Umm... lets see... choo choo choo.
 Pam, its Michael.  I need you to go into my office and check some data for me.
 Yes.
 No.
 Nope.  Told it.  Not as good as you think.  Pick another one.
 Oh ho ho, yea!  Bingo! And a lighthouse.  Yes.  That is hysterical.  Could you start that one from the beginning?
 First guy says "Well, Im an astronaut, so I drive a Saturn".  And the second guy says, "Well, I am a pimp, so I drive a cheap Escort".  And the third guy says "I gotcha both beat, Im a proctologist, so I drive a brown Probe".
   Yum! Yum yum yum!   Thats delicious!  I love it!
 Bop! Be blah bop, be boo boo bop.
 Thats why I wanted a signal, between us, so that I wouldnt have to just shout non-sense words.  Thats her fault.
 Did somebody say "baby back ribs"?  Hmmm? Hmmmmm?
  I want my baby back, baby back, baby back
  Chilis baby back ribs...
 Woo, well, this brings us to Jan.  Truth or Dare?  Tell us about your divorce. Ohh, ohh.
 Oh, so youre not gonna play?  Shes not playing.
 Shes not playing the game.
 Check please.
 No, you were not stupid.  Gould was stupid.  Right?
 You know?
 Its true.
 Uh huh, Kenneth Road, born and raised.  Spent my whole life right here in Lackawanna County and I do not intend on movin.  I know this place.  I know how many hospitals we have, I know how many schools we have.  Its home, you know?  I know the challenges this countys up against.  Heres the thing about those discount suppliers.  They dont care.  They come in, they undercut everything, and they run us out of business, and then, once were all gone, they jack up the prices.
 Its bad.
 It, you know what, it really is.
 Well, corporates gonna go ballistic, but, uh, you think we could Jan?
   See ya.
 We did it!
 Nailed it.  Nailed it!  Come here.
 What!?
 Goin. Ok.  Where we goin?  Doesnt matter.  Goin to the go go.  Oh-ok.
 Morning, Pam.  Hey.
 No, nothing happened.  I-I swear, nothing happened.  What, Im, totally being serious.  A gentleman does not kiss and tell, and neither do I.  No, seriously, guys, Im not, I dont want to go into it at all.  Its off limits.  Fine, I took her back to her hotel and we made out for a little while.  It was great.  I mean she told me about her divorce, we talked for about five hours, she fell asleep on my arm.  So.
 Hello, Dwight.
 Who.
 Uh, no, no, no Gould.
 This is none of your affair because she is your boss-
 And she is a woman.  She is a strong, soft, thoughtful, sexy woman.  And you know what?  I dont think that I can sit here and let you talk about her that way without me defending her honor.   Jan, I defend your honor.    Is that all?
 I know we have to register as a consensual sexual relationship with HR.  My question do I do it as the man?  Does she do it as my superior?  I dont know.  That leads to other issues that we may have in our relationship.  Its, uh,  Excuse me.  Hello?  Hi!  Just talking about you.  The camera?  No.  Uh huh.  Hows traffic?  I miss you.  What.  Ok.  Well, if it was a mistake, it was a wonderful mistake.  No.   Would you excuse me?  No, I did not intentionally get you drunk. Um hmm.  No, no.  This is just a fight. This is just a first fight of many fights were gonna have.  Right.  No.  Wha-so-I dont understand, you wanna see other people.  Only other people.  Wh-why, ok, I think youre still a little bit drunk  Excuse me?  Excuse me?!   I think youre, yes, why dont you just come back here, go to the hotel, have a few drinks and-no, no.  I didnt slip you something!
 Pam, could I see you in my office?
 Pam, youre trustworthy-
 And a woman-
 And I want you to listen to a voicemail from my boss.  "Michael, its Jan. I guess I missed you.  Ill, uh, be there this afternoon for performance reviews.  I hope its understood that that will be our only topic of discussion. See you soon."  First impressions?
 My boss is coming in today, the lovely Jan Levinson-Gould will, well, no Gould. The Gould has been  swack, divorced.  Um, the awkward part is that this will be the first time that well be seeing each other since, well, uh, it was really nothing.  We just sort of got caught up in the moment.  The vulnerable divorcee gives herself to the understanding, with rugged good-looks, office manager.  Just, uh, she didnt want it to continue for some reason.  It, we both, I didnt want it, we both didnt want it to continue.  Was not professional.  Um, when people say somethings mutual, it never is.  But this was mutual.
  "I guess I missed you." I guess I missed you.  So, she misses me?
 But then she goes on to say "that will be our only topic of discussion".  That doesnt mean anything, those are just words.
 Ok. Yeah, what, what?
 Ohhh, great.  Well, now Im in a terrible mood.  Lets do your performance review-
 Ah, why, thats great news?   That, that, then why would, why would I not like that?
 Oh, wow, wow.  Alright, lets listen to that again.  "Michael, its Jan.  I guess I missed you".
 Really?
 God, Stanley, thats frickin brilliant. How do you know that?  Did you learn that on the streets?  Sorry.
 No kidding.
 Good work, Stanley. Great performance review.  Stanley in the house, everybody.  Woo!  Angela, your turn.
 Yeah?
 Oh; Angela, you were totally satisfactory this year.
 Interesting.  Jan is calling me.  Maybe it wasnt so mutual after all.  Yeah?
 Jan!  To what do I owe this pleasure?
 Well, hello to you, too.  Um, yeah, I was just um, I just wanted to get some closure on uh, what transpired between us at the meeting we had in the parking lot of the Chilis.
 Well, surely this uh, review is a formality because of what happened uh, at our meeting in the parking lot of Chilis.
 Oh.
 Been thinking about you.
 Um, I dont see how thats unprofessional. Just-
 Yep.
 No.
 They are not.  Yes, they are.   Thats my girlfriend.
 Pam, I have ideas on a daily basis. I know I do.  I have a clear memory of telling people my ideas.  Um, is there any chance you wrote any of my ideas down?  In a folder?  A "Michael-idea" folder?
 Thats unfortunate.  How bout the suggestion box?  Theres tons of ideas in there.
 The suggestion box that I put out, and people could be put in suggestions anonymously?  Maybe theres prizes?
 Why dont you find it and tell people to get theirs... never mind, Ill tell them.  Hello, everybody?  Yeah, uh, attention, please.  Jan Levinsons coming, very soon, and so, were going to have our weekly suggestion box meeting, so you can all get your constructive compliments in a.s.a.p.
 What did I say?
 Well, Kelly, that was neither constructive nor a compliment, so maybe you should stop criticizing my English and start making some suggestions. K?
 Hi, Jan.  How are you?
 Good to see you.
 Ok.  Ok, why dont we just step into my office?  Were gonna go in here.
 Yep, right after you.  Apres-vous.  No calls.
 Alright .
 Its nice to see you.
 Really?
 Oh, well.
 Alright.
 Yep.
 Absolutely.
 Im a little confused.  Cause first its all like kissy-kissy.  And then its like all regret.  Because "Oh, I regret that."  But, "Wait, Im still gonna call you."  But, but, "Were just gonna talk business.  And I may come down and fire you if you dont do your job."  But what were talking about when we first kissed?  Business.
 No, no, no, I finished all of that.  Im very fast.  Im not too fast.  Not like wham-bam-thank ya maam.  But I do say thank ya maam.  But, Im, Im not like wham-bam.  Not that theres anything wrong with wham-bam.  If its consensual.    Were talking about office stuff.  Can I ask you a question?
 This is a business question. Its nothing personal, I promise.
 Are you wearing a new perfume today?
 Well, youre wearing it at the office. And  it, Im sorry, but no offense, but its really sexy.
 I dont understand-  Hold on.  Sorry.   Yes, Pam.
 Im kind of in the middle of something. I wish you wouldnt interrupt.
 I did not, not, not use those words.
 No, its in like ten minutes.
 Why are we here?  Because I value your opinions.  Now, I know a lot of dont think that I read your suggestions, but I do.  I just sift through them every week and I really look and scrutinize to see what you guys are writing.  Um, so, lets, uh, just read some of these suckers.  Alright.  Number one "What should we do to prepare for Y2K?"
 Well, obviously this one got stuck in the box.  That happens occasionally.
 And, um, one down.  Next suggestion "we need better outreach for employees fighting depression".  Ok, alright, enough with the jokes.  Nobody in here is suffering from depression.
 Oh, ok, well, yeah, who wrote it?
 Tom.  Then it is a joke because there is nobody in here named Tom.
 Oh, that guy?  That guy was weird.  Alright, next suggestion.
 Arrr, dooby dooby do. "You need to do something about your B.O."
 Ok, I dont know who this suggestion is meant for, but its more of a personal suggestion and its not an office suggestion.  Far be it for me to use this as a platform to embarrass anybody.
 Well, Toby, if by me you are inferring that I have B.O., then I would say that is a very poor choice of words.
 Was I, Creed?!  Ok, well, you know what? I am implying is that when were on an elevator together, I should maybe take the stairs, because talk about stank.  Not that I would ever say something like that in public, and I never have, and I never will. I just think its something that we should all be aware of.  Ok?  Now that weve learned this, lets continue.  See, this is good, were learning and were figuring some stuff out.  "You need to do something about your coffee breath"-
 Ok.
 Shut up, shut up, shut up, Dwight, OK. I dont think you people are grasping the concept of the suggestion box.
 Yeah, is that hard for you?  Alright, well-
 Ill work on that-
 Lets keep going.  Keep it going.  Yep.  What do we have here?  We have somebodys piece of gum.  Somebody put a piece of gum in there.  This is not a, a garbage can, this is the future of our company.  This is not a place for gum.  I dont wanna have to read these tomorrow.
 Yeah, what? Uh, alright, next suggestion.
 "Dont sl-", ok, thats blank  Dont, just put it-
 I dont understand why youre so upset.
 Let me ask you-
 Ok, let me ask you this.
 Let me ask you something.
