 Tonight is the Dundies, the annual employee awards night here at Dunder Mifflin.  And this is everybodys favorite day. Everybody looks forward to it, because, you know, a lot of the people here dont get trophies, very often. Like Meredith or Kevin, I mean, whos gonna give Kevin an award? Dunkin Donuts? Plus, bonus, its really, really funny. So I, you know, an employee will go home, and hell tell his neighbor, "Hey, did you get an award?" And the neighbor will say, "No man. I mean, I slave all day and nobody notices me." Next thing you know, employee smells something terrible coming from neighbors house. Neighbors hanged himself due to lack of recognition. So...
  Hey hey hey! Its Fat Halpert.
  Fat Halpert.  Jim Halpert.
 So why dont I take you on a tour of past Dundie winners. We got Fat Jim Halpert here. Jim, why dont you show of your Dundies to the camera?
 Oh, thats a good idea.
 Gyaaah. T.M.I. T.M.I my friends.
 T.M.I.? Too much information. Ah, its just easier to say T.M.I. I used to say "Dont go there" but thats... lame.
 And here we have Stanley the Manly. Now Stanley is a Dundie all-star, arent you Stan? Why dont you, ah, show them some of your bling.
 Oh, no you di-int.
 W-why did you...
 Yes we should. I... you know what?  I wanted one of those skillets of cheese, but when I got off stage,  someone had eaten all of them.
  To Oscar Martinez its the "Show Me the Money" award! Yeah!
  He has the award-ah! ...its a type of song that we are going to play for the ladies. Hit it, Dwight!
  A little bit of Paaam, all night long, a little bit of Angela on the thing...
 ...a little bit of Phyllis everywhere...
  ...a little bit of Roooy eating chicken crispers... ...a little bit of Jim with some ribs, a little bit of...
  Will her highness, Jan Levinson-Gould, be descending from her corporate throne this evening to visit us lowly serfs here at Dunder Mifflin Scranton?
 Well, you could take the bus.  You could work on the way here. Sleep on the way home.
 Wuh... Come on, Jan. This is important. I mean, this is, this is, validation to my employees here that you and corporate approve of this. So...
 Um...
  Could you...?
 Yeah, Im here, I just wanted to, uh, talk to you for a second about that.
 Um, what, ah, what is, I mean...
 ...come on, Jan!
 Youre dropping an A-Bomb on me here.
 Well, yeah, I mean, what is...
 No reason?! It was the 05 05 05 party...
 ...it happens once every billion years.
 Okay, no, that was a FUN raiser. I think I made that very clear in the fliers, fun, F-U-N.
 Well, I think a lot of people were very affected by the footage.
 This is a little character I like to do , it is, uh, loosely based on Karnack, one of Carsons classic characters.  Here we go. The PLO, the IRA, and the hot dog stand behind the warehouse.  "Name three businesses that have a better health care plans than Dunder Mifflin."  Heres the problem. Theres no open bar because of Jan and its the reason why comedy clubs have a two drink minimum. Itll be fine, I just...wish people were going to be drunk.
  The Dundie award for "Longest Engagement" goes to Pam Beesley.
 Pam, everybody!
 Whoooo! When is that girl gonna get married? Thats what I have to say. Ah, Roys accepting.
  Thank you Roy. Are there any words youd like to say, on Pams behalf?
  Yeah, oh, hope not! Oh God!
 Im not changing that, its the best one.
 Thats why its funny. Every year that Roy and Pam dont get married, it gets funnier.
 Oh,  lazy. Uh huh.
 Yes.
 Okay, well, thats just ridiculous, so just dont, I-I dont have time for this right now.
 Just dont, dont talk-
 Dont talk-
 Just STAP IT YAP IT!!!!
 Okay, look, I know there have been a lot of rumors flying around about the Dundies this year. How there is no money, and how there is no food, and how the jokes are really bad, but WHAT THE HELL EVERYBODY!? I mean, God. The Dundies are about the best, in every, one of us. Cant you see that? I mean, okay, we can do better. so, tonight, for the first time, we are inviting all of your friends and family to attend the awards with us.
 Yeah, not bad, right? So lets make this the best Dundies ever.
 "The Dundies, how can I explain it? Awards you like to hate it. Im psyched you all made it. You never had to work so hard and feel that no one notices you.  Youre just a name and number and no one even says hello."  Card!
 "You down with The Dundies? You down with the Dundie-"
 Alright, alright, joke landed. So we are here, thank you all for coming to the 2005 Dundie awards.  I am your host, Michael Scott. And I just want to tell you please, please, do not drink and drive. Because you may hit a bump and spill the drink!
 Nope, actually this year, ah, no group tab, were going to be doing separate checks.
 I did. And why didnt ya Stanley?
 Well, Im looking forward to meeting Terri.
  Shut it.  Um, good. Speaking of relationships, of all, all way shapes and forms. Um, I was out on a very, very hot date with a girl from HR, Dwight.
 No, that...for the sake of the story. And things were getting hot and heavy.
 And I was about to take her bra off...
 ...when she made me fill out six hours of paperwork-
 No!  God.
  Alright, so lets get this party staaaarrrrted.
 Um, guys, where you going? Pam, shows just getting started.
 And now... to someone who quietly goes about their job, but always seems to land the biggest accounts...
 ...the "Busiest Beaver" award goes to Phyllis Lapin.
 Yeah, way to go Phyllis. Nice work, per usual.
 What? I told them busiest...idiots.
 Well, well fix it up. You dont have to display that.
  Herro everybodeeee. Im gonna cwall Jan Revinson-Gould.
  Oh, dat wir be fwar. Ah, me so horny.
 Right? You know wat Im talking bout.
 This next award goes to somebody, who really, lights up the office.
 Somebody, who I think a lot of us, cannot keep, from checking out. The "Hottest in the Office" award goes to... ...Ryan the temp!
 Yeah.  "Hidy ho, you sexy thang. You sexy thang you." Here you go.
 And the "Tight Ass" award goes to Angela.  Not only because she is everybodys favorite stickler, but because she has, a great caboose.  So...come on down.
 The "Spicy Curry" award goes to our very own Kelly Kapoor!  Get on up here. Here you go.
 Um, not everything means something, its just a joke.
 I dont know, its just...
 I know. Its ju- they didnt have any more businessmen. So...
 Just sit down Kelly.
  Its so freakin hot in there. Now I know what Bob Hope was going through when he performed in Saudi Arabia. Man! I got Dwight sucking the funny out of the room, but you do what you can do.  Here we go, hes early with the cue. Here we go.
  "You have won a tiny Dundie."
 Hey, thanks guys. Hey, where you guys from?
 Oh, alright, yeah.
 Uh, you know what guys, were just having a little office party, so if you want, uh...
  Hey, you know, cool it guys, really-
 Lets cut it.
   I had a few more Dundies to, uh, give out tonight, but, Im just going to cut it short. And wrap it up so everybody can enjoy their food. Um...thanks for listening, those who listened.  This last Dundie is for Kevin, this is the "Dont Go in There After Me" award. Its for the time that I went into the bathroom after him, and it was really, really smelly. So...
 There you go.
  Alright, alright, alright, okay. Alright, well keep rolling. Okay, this is the fine work award. This goes to Stanley, for all the fine work he did this year.
 You know you did.
 And this next award is going out to our own little Pam Beesley...
 ...I think we all know what award Pam is going to be getting this year.
 It is the "Whitest Sneakers" award! Because she always has the whitest tennis shoes on!
 Get on down here! Pam Beesley ladies and gentlemen!  Oh, here we go.
 Pam Beesley ladies and gentleman.  Oh! Thank you.
 Was this years Dundies a success? Well, lets see, I made Pam laugh so hard, that she fell out of her chair, and she almost broke her neck. So I killed, almost.
 Great work tonight.
 Excellent.
 Yes, that too, but I mean with the audio. Great work.
  Hey, whats up?
 Any emails today?
 No? Um... Check your spam folder.
 What?
||
 Kay.
 I am king of forwards. Its how I like to do business, everybody joking around. Were like Friends. I am Chandler and Joey and, uh, Pam is Rachel. And Dwight is Kramer.
 Thats funny! Thats funny. Not offensive. Uh... because its nature. Educational.
 Um, I...
 Yeah... maybe. Maybe. Well, well see. Because I... I dont know if its...  Whup! Come on! Hey!
 Kay! Oh, you are so bad! Yeah!
 Oh, Boom! Bam! Oh, this guy is out of control! He is a madman! Better get the bleep button ready for him.
 Uh oh.
 Uh oh! Oh-ho-ho-ho-ho-o!
 Todd Packer and I are total BFF. Best Friends Forever. He and I came up together as salesmen. One time, we were out and we met this set of twins. And Packer told them that we were brothers. And so, you know, one thing led to another, and we brought em back to the motel. And then Packer did both of them. It was awesome. So...
 Oh-whoa-oh! Oh! Okay. Grade A gossip for you, right now. Randall, CFO, resigned. Nobody knows why.
 Really? Here we go! Buckle up. Its going to be a bumpy one!
 Oh, yeah.
 Well, to be fair... blondes, brunettes, you know, theres a lot of dumb people out there.
 Oh! Wow! I didnt say it! I didnt say it!
 Oh, wow! What did I tell you about the bleep button.
 Oh. Bad boy.  Um... Ryan?
 Ah! Man. That Todd Packer can do anything.
 Hey, send me that link to the monkey sex video. Im going to forward it like its hot.
 Forward it like its hot. Forward it like its hot. "Old School".
 Yes, Toby?
 Um... literally two seconds?
 Toby is in HR which technically means he works for Corporate. So hes really not a part of our family. Also hes divorced so hes really not a part of his family.
 No, no, Toby. No.
 It is a big deal. Its a big deal! What are we supposed to do? Scrutinize every little thing we say and do all day? I mean, come on!
 What?
 NO!
 What? He! No! Okay, what is a lawyer going to come in and tell us? To not send out hilarious emails or not tell jokes?
 There is no such thing as an appropriate joke. Thats why its a joke.
 Everyone! Hello! Everyone. Hi! Sorry to interrupt. I know youre all busy and the last thing you want is for a major interruption. But Toby has an announcement that he insists on making right now in the middle of the day.  So, take it away.
 I wish you luck, Toby. I really do. But you are going to have a mutiny on your hands and I just cant wait to see how you handle it.
 A guy goes to a five dollar... lady of the night and he gets crabs. So, the next day he goes back to complain. And the woman says "Hey. It was only five dollars. What did you expect? Lobster?" This is whats at stake.
 Time to bring out the big guns. Im heading down to the warehouse where jokes are born. Find a killer joke thatll just blow everybody away at the seminar later. And remind them what is great about this place. So... ah! Here they are.  Guys! Wondering if I could, uh, get your help for something. Im looking for a new joke to tell and it needs to be just killer. And it does not need to be clean. So whatcha got?
 Um, yeah, no, well... I mean better. Better than that. The type of stuff you guys tell all day.
 Alright, alright. Well, yeah, but, you know... a joke but not necessarily at my expense.
 Oooh, okay. That was still about me.
 What?
 I dont feel bad.
 No, I dont.
 Okay.
 Well, not exactly what I was looking for but thanks guys.
 Thank you.
 Hi, is it over?
 No.
 I know, I know. Its good. It is not over. It is not over til its over.
 Did he tell you everything? Obviously, he didnt because you all still look relatively happy. Albeit bored. Do you realize what were losing? Seriously?
 Exactly! Mmwwah ! Can we afford to lose email forwards? Do we want that?
 Give me a break. Umm... Stanley, how about that hot picture you have by your desk? Centerfold in the Catholic schoolgirls outfit? I mean, it is hot, it is sexy, and it turns him on. And I will admit, best part of my morning is staring at it. But what? Are we just going to take it away?
 I think the old honor system was just fine. For example, I have never slept with an employee. And, believe me, I could have.
 No! No! Catherine. Remember her? Remember how hot she was?
 She would have definitely slept with me.
 Yes, she was. Dammit, Kevin!
 What if Pam was a lesbian? What if she brought her "partner" in to work?  Would that be crossing the line?
 What if they made out? In front of everybody?
 At home? And I told everybody everything about it.
 Okay. Well, then lets act it out. Pam, you will be girl A and girl B will be... Okay! Well use the doll. Pam. Pam?
 I wish Todd Packer was here because he would love this. I wonder if anybody else would like to do this. Hey! Um... we have to watch, uh, Tobys video that hes showing us in order to brainwash us and I was wondering if anybody would like to join in? Going to be fun. Got my great pizza. Whataya say? Jim?
 Thats what she said. Pam?
 Thats what she sai   Nope, but... Okay. Well, suit yourself.
 Whoa, whoa, whoa, whoa... Okay! Hypocrite! She is a hypocrite. That is such a scam! Okay.
 Okay, you are never going to believe this. The girl in the video were watching that Corporate gave us... Darryl banged her! Aaand is about 90% sure.
 So you are the lawyer, Mr. OMalley? I know a lot of lawyer jokes.
 Well, its probably because you dont get em.
 When I said before that I was king of forwards, you got to understand that I dont come up with this stuff. I just forward it along. You wouldnt arrest a guy whos just delivering drugs from one guy to another.
 The problem is that I am the boss and apparently I cant say anything.
 Wheres the line? Wheres the line, Jan.
 No, Ive seen the video.
 No, I didnt.  Huh, what?
 Attention, everyone! Hello! Ah, yes! I just want you to know that, uh, this is not my decision, but from here on out... we can no longer be friends. And when we talk about things here we must only discuss work-associated things.  And, uh, you can consider this my retirement from comedy. And in the future, if I want to say something funny or witty or do an impression, I will no longer, ever, do any of those things.
 Mmmhmm. Yes.
 THATS WHAT SHE SAID!
  Come on.
 Mwah!
 You would have done the same. You just didnt think of it first.
 Its... Thats...
 Okay.  Hello.  Jan. Mr. OMalley. This is my lawyer, James P. Albiny.
 I believe you may recognize his face from the billboards. He specializes in Free Speech issues.
 This guy does it all.
 What?
 So Im not in trouble?
 I am so used to being the bad boy. I am so used to fighting Corporate that I forget that I am Corporate. Upper management. They hooked me up with an attorney. To protect me. You cant be too careful about what you say. Mo money, mo problems.
 Okay. Well, lets get you out of here, James. Um... I think were under an hour still, so...
 I know. Well talk about it later. Thanks for coming in.
 No. No, no, no. That crosses the line.
 Not you. Kevin. Just unwarranted. Hostile work environment, Kevin.
 No. You said it. He pointed. A point is not a say. Look. Kevin, we are a family here and Phyllis is a valued member of that family. Like a grandmother.
 I dont know about that.
 Well, I have a late birthday and usually Septembers a cut-off point.  You know what? You just crossed the line. Okay? Theres a line and you went over it. And you must be punished. So go to your corner.
 Yes, your corner. Go.
 Mmmhmmm.
 They didnt get to me. I got to them. I am still the same old Michael Scott. New and improved. You know what? I love Phyllis. You know what else? I think she is gorgeous. I think she is incredibly, incredibly attractive person.  Cmere, cmere, cmon!  Come on! Come on.
 Oooh!
 Im not worried.
 You know what? The only thing Im worried about... is getting a boner. Good work today, everybody.
 Times have changed a little. And even though were still a family here at Dunder-Mifflin, families grow. And at some point, the daddy cant take a bath with the kids anymore. I am Upper Management. And it would be inappropriate for me to take a bath with Pam. As much as I might want to.
 Im an early bird, and Im a night owl. So Im wise, and I have worms. Oh, breakfast.
 Yummy, yummy. Thank you, Ryan.
 Um. The sausage, egg, and cheese biscuit. But thank you. And why dont you take a couple hours. The office is yours. "Home Alone," "Risky Business." Take your pants off, run around. Whatever you gotta do.
 Ok.  Healthier. Gotta watch those carbs.
 Today, I, Michael Scott, am becoming a homeowner. Investing in real estate.
 Yes it is. Yes it is. It is very important to own property. Back in olden days, they would not even let you vote unless you owned property and theyd throw you in the stocks and humiliate you.
 Maybe.
 Yes. Yes. Final walkthrough.
 Sign the papers at the condo.
 Uh, I dont need one.
 I dont need a representative.
 No, No.
 No. Dwight. Im fine.
 Well, this isnt about work. This is closing on a condo, its completely personal.
 Except that, this is about my living arrangement, and as boss, I need to have a living arrangement in order to do work.
 Ok. Fine. Yes, you can come.
 As my associate.
 No it is not.
 Oh, most honorable Pamera. Not offensive, because thats the way they talk in movies.
 We are. Dwight and I are going to the big thing. So why dont you have everybody work on their expense reports and Id like them in by the end of the day.
 Very good.
 We will. Um, did you do the thing I asked you to do about the magazines?
 Good. The Small Business Man?
 Maxim? American Way? Cracked?
 How about, uh, Fine Arts? Aficionado Monthly?
 NO, well can you get on that, because I dont just read Cracked.  Thank you.
 Ok. See you soon.
 I dont know, regular. Normal ones. Nothing fancy. Not my style. What are you doing?
 What? No, Dwight. Its fifty degrees outside.  Dont... please...
 I... Just... Would you put it up?  Ok. Fine. Just leave it down. Whiner.
 I do not understand what you spend your money on.
  Home, sweet home.
  Right there. My sanctuary. My party pad. Someday I can just see my grandkids learning how to walk out here. Hang a swing from this tree. Push them back... wait...  no, its this one, right here. Home, sweet home.
  Oh, how are you? Nice to meet you, Bill. Bill. Mr. Bill. OHHH NOOO. MR. BILL. OHHH! SNL? When they pull him apart? Hed always get rolled over by something.
  Nice to meet you too.
  Yeah, small. Im buying it and Im not renting it. So, its still an upgrade. He doesnt know anything about property ownership. Kind of an idiot. Um.
  Oh. Good. Thats good. Its good to be accommodating of that.
  This, my friends, is the master bedroom. Check out the cathedral ceilings. Those are like seventeen feet high. We have cable readiness.  Right there. I am going to totally pimp this place out. I am going to put a surround sound system. I am going to put a plasma screen right against this wall.
  Im putting my bed right over here.
  Well, then I will get a warrantee.
  Well then I wont get a warrantee.
  So thats the problem, is solved. What?
  Uh... Ten year.
  What? Wha? You said ten.
  Ok, ok, ok.
  Alright.
  Ok. Alright. Oh boy.
  Um. Oh.  Oh, ok. Is that suppose to come off?
  Um. Im going to take a little breather for a second. Excuse me.
  Oh, man.
 Uh.
  The ceilings are lower than they were last week. That, I dont... I dont...
  ...know if you showed me this same unit or not.
  Where are all the hot people? I was told that there would be all these attractive singles.
  As far as I can tell, Im the best-looking person here.
  Theres a basic principle in real estate, that you should never be the best-looking person in the development. Its just sorta common sense, because if you are, then youve no place to go but down.
  No, no, no.
  I am not going to rent the third bedroom. I want a price reduction or I am a-walkin.
  Ehhhh....
  I made the right decision. Im glad I signed. Im a homeowner. Right? Good to be a homeowner. Diversifying. This is good. This is fun. Were having fun.
  Theres something else Dwight wanted to talk to you about. I have a surprise for you, for helping me out today.
  No, no. I insist. I insist. Because youve really done some great work. Great work. And that is why, I am going to let you move into my third bedroom and pay me rent.
  Why did I do it? Because I believe in rewarding people for their efforts. Ah. I rewarded Dwight with the room, and he is rewarding me back, ah, with $500 plus utilities.
  Im thinking, lock into a four year commitment, well go month to month after that. Or, until I start dating, have a girlfriend, then youre, you know, youre gone.
  What the hell is a terrarium?
  Oh, so an aquarium. Ah, that will not come into this place.
 We take separate cars.
 Why would we do that?
 No.
 EHHHHNT. Game over. Offer revoked. Dwight. Im sorry, but you reach out and you try to be a nice guy, and help out a friend, and this is what happens. This is what I get. Oh god. Im ... Ok.
 Yeah, well, you know what? Nobody cares about your stupid beet farm. Beets are the worst.
 Nobody likes beets.
 Nobody likes beets, Dwight. Why dont you grow something that everybody does like? You should grow candy. Id love a piece of candy right now. Not a beet.
 Stop it!
 Yeah. Jim. Slim Jim. Whats going... Whats going on?
 Oh. Thanks. Thanks. Its very cool. Its a three bedroom, gay-friendly.
 You know.
 Really?
 Whats this?
 I dont really know what to say. Um, Im not one for making speeches, but ah, my heart is very full at this moment.
 Get up here, Dwight.
 Yep, not as good as gold.  Why are you playing the national anthem?
 Oh.  What the hell is that?
 Howard, slash Ryan, Ryan Howard is sitting in my office. And he has been a temp here for a couple of months and hes kind of gotten the lay of the land a little bit. Had a few laughs along the way. And now he wants to know what I think.
 Shall we? Let us proceed. First up, proficiency in necessary skills. Aaaaeeexcellent!
 Five years from now, what do you want to do? Where do you want to be?
 Oh! Good. Ambitious. Excellent. Want to be a manager?
 That is ridiculous.
 Ryans about to attend the Michael Scott School of Business. Im like Mr. Miyagi and Yoda rolled into one.
  Much advice you seek.  Do you know who that is?
 Mmm... No. That was Yoda.
 There are ten rules of business that you need to learn.  Number one You need to play to win. But... you also have to win to play.
 And I will give you the rest of the ten at lunch.
   Hey!
 Yes, I was the first one out. And, yes, Ive heard women and children first. But, we do not employ children. We are not a sweat shop. Thankfully. And, uh, women are equal in the workplace by law. So, I let them out first, I have a lawsuit on my hands.
 Another rule of business is being able to adapt to different situations.
 Adapt. React. Re-adapt. Act. All right? Thats rule number two.
 So what was rule two?
 Okay, well, lets... . lets kind of take it a little slower.
 Okay, uh, well, one is taken.
 Well, he needs a permanent number, right?
 Um, yeah.  Okay. That... No, no, no. I got one. I got one. The Three Stooges.
 Rule number four. In business, image is everything - Andre Agassi. This car is an investment. Right? If I have to take out a client or Im seen around Scranton in it. I love it. I love this car. Do you like it?
 Wow, some pretty big books back there, huh?
 Hello, Mr. Egghead! Woop!  So... oh, Stanley Kaplan! I know him. M is for Murder, P is for...
 ...for Phone. What?
 Um, oh, thinking about business school?
 Really?
 So you think you know a lot about business?
 Uh huh.
 Yeah. Quiz me.
 Come on, egghead. Lets do it.
 Quiz me up.
 Uh...
 When I was Ryans age, I worked in a fast food restaurant, to save up money for school. And then I spe... lost it in a pyramid scheme. But I learned more about business, right then and there, than business school would ever teach me, or Ryan would ever teach me.
  Shut, it. Can I... can I just do it please?  Uh, its equal.
 Okay. Yes! It was a trick question.
 Okay, Dwight.
 You know what, Dwight? You dont need to help me here. Okay? Well, you know... Maybe you should go to business school like Ryan, then... then youd know what youre talking about.
 For instance, why dont you go to business...
 Stop. Dwight. You know what? Youre acting like a dork. Would you cool it? Please. Okay. Hey! Hes not your five year old brother, Dwight. Hes a valued member of this company... and you know what? He knows more about business than you ever will.
 I did not go to business school. You know who else didnt go to business school? LeBron James, Tracy McGrady, Kobe Bryant. They went right from high school to the NBA. So... so its not the same thing. At all.
 Look at this stuff. Market fragments. What is that supposed to be?
 You are so smart. You are so eff-in smart. You should be teaching me.
 I became a salesman... because of people, I love making friends. But then I was promoted to manager, at a very young age. I still try to be a friend first, but... You know? Im very successful... your coworkers look at you differently. Huu, what do you think?
 Nah, Im okay.
 Oh, hey. Game, what game are we playing here?
 Oh, I play this at home all the time while Im falling asleep. What, uh... . Where are we? Where are we here?  Mmm.. Roy? Roy? Who would you do, Roy?
 Aaaall right. Whos next, whos next, whos next, whos? Jim? Youre next. Who would you do?
 Well, I would definitely have sex with Ryan. Cause he is going to own his own business.
 Whos, uh... Whos next? Who we got? Whooo...
 Wish I had my cell phone, but I left it inside. So...
 Whats that?
 Yeah.
 Dwight. Hey!
