 Ok, well I did not get the job in New York, but I got the real prize, domestic bliss. Jan made me breakfast this morning... well she bought the milk. Its soy.  This is why I do it, thats what I have to come home to.  She probably wont be up for a few hours.
 This is going to be a very good year. Very good. Jan is at home. Jim is back. My protege Ryan is at corporate. Good stuff. Um... Andy and Dwight are rockin the sales team. I feel very blessed.
 Ladies and Gentlemen. I have some bad news. Meredith was hit by a car.
 It happened this morning in the parking lot. I took her to the hospital, and the doctors tried to save her life. They did the best that they could... And she is going to be OK.
 Yes. She has a slight pelvical fracture, but, ah... people have survived far worse.
 Yeah.
 Gah. Kind of a good news bad news there. I was able to be on the scene so quickly because I was in the car that hit her.
 Yeah, its only Meredith, thank God. But did you see the way they looked at me? Like I was a murderer or something.
 It was an accident.
 No.
 My lord my liege.
 So Ryan got promoted to corporate, where he is a little fish in a big pond. Whereas back here in Scranton I am still top dog, in a fairly large pond. So who is the real boss? The dog or a fish?
 So I need a little treat for the gang. Something to win their affections back.
 Well, I ran down Meredith in my car.
 No, I was being negligent. But shes in the hospital, shes fine, recovering nicely. Tiny little crack in her pelvis. But she will be up in...
 Yes. It was on company property, with company property, so... double jeopardy, we are fine.
 Oh, right, Im sorry. What is we are fine?
 Ok, I have an announcement.
 No.
 No! That is not funny, I love my employees, even thought I hit one of you with my car. For which I take full responsibility. Look Im just trying to take everybodys mind off of this unavoidable tragedy, and onto more positive things. So I thought we should plant a tree.
 So, like a freedom tree.
 Pam.
 Pam.
 Ok, good good, so well just all go down there together at lunch.
 Excellent!
 Good work Pam.
 Yaaaaaay, Pam! Alright, since I am the boss I will drive as well. Who wants shotgun?
 Everyone inside the car was fine, Stanley!
 Guess what, I have flaws. What are they? Oh, I dont know. I sing in the shower. Sometimes I spend too much time volunteering. Occasionally Ill hit somebody with my car. So sue me... No, dont sue me. That is the opposite of the point that Im trying to make.
 Eww. I hate hospitals. In my mind they are associated with sickness. Oh... She looks like an angel.
 No... OK, she always looks like that... That is not my fault.
 No... Shes in a coma.
 OK... Meredith,  Ooooohhhhh. I brought all your friends from the office dear.
 Yeah.
 Brought you some balloons. Why dont we... here you go.  Tie these up, cheer up your tubes...  Oh! Shhhh... For Gods sake!
 Nurse.
  I am going to be sick... Im gonna puke.
 Oh, OK... Wait up, wait up, guys guys guys, hold on a second. You know what I was thinking might be sort of fun? Is if you forgave me in front of everybody.
 Cause you know what they say in the Bible about forgiveness? Forgiveness is next to Godliness.
 Well, just shhhh... just just...
 Look, I just... I dont understand what is preventing you from laughing this off and giving me a big hug.
 Come on. [starts to climb onto the bed with meredith.
 Do I need to be liked? Absolutely not. I like to be liked. I enjoy being liked. I have to be liked. But its not like a compulsive need to be liked. Like my need to be praised.
 OK, you know what? Everybody, lets just get over the whole Meredith thing. She cracked her pelvis, a tiny little crack. She going to be fine, so lets just...
 Sprinkles?
  Oh, sh... Im sorry Angela. Man what a day huh? How could it get any worse? Her computer crashes with the porn, and then Meredith with the accident, and then... Sprinkles! God, thats 3 things. Ill tell you whats going on. This office is cursed, and we need to do something about it.
 Well, I am taking responsibility. It is up to me to get rid of the curse that hit Meredith with my car. Im not superstitious, but... Im... I am a little-stitious.
 Did anyone do anything involving an Indian burial ground?
 Like park on it. Or dig up a body... Toby? Anything you want to tell us?
 Perfect. So our tragedy is your good luck. Satan.
 Dwight, you havent seen Meredith yet, have you?
 Well, I think you should go to the hospital, and pay your respects.
 Alright, I would now like to talk about each of your individual religious beliefs.
 Satan is a master of lies. Everything he says is the opposite.
 Thank you for the permission. Psych! Alright lets just go around the room, and tell me what you believe in.
 OK.
 Alright.
 Kelly, you are Hindu, so you believe in Buddha.
 Are you sure?
 What are you?
 OK, 1 Sikh, and...
 You spend your whole life trying to get people to like you, and then you run over one person with your car.  And its not even one of the popular ones, and everybody gets on your case. Doesnt make any sense... God is dead.
 Maybe believing in God was the mistake. What did people believe in before? The sun? Maybe theres some sort of animal, that we could make a sacrifice too. Like a giant buffalo, or some sort of monster, like something with the body of a walrus with the head of a sea lion. Or something with the body of an egret with the head of a meerkat. Or just... the head of a monkey, with the antlers of a reindeer, with, ah... the body of a porcupine.
 Oh God, Rabies?
 I was in the hospital room with her. How contagious is that, is that like an STD?
 This place is so cursed.
  I know a lot of you are upset with me for endangering Merediths life by hitting her, with my car. But it may make you feel a little better to know that before that happened, Dwight endangered her life, by putting a garbage bag over her head that had a bat in it.
 Turns out Meredith has been exposed to rabies. Which is like 10 times worse than a little crack in your pelvis. Thanks to me she went to the hospital and I saved her life. Curse is broken. Curse is broken people!  Oh... there is a God, and he has a plan for us after all. So go home get some rest, very very good work today. We got a lot accomplished.
 Is there a God? If not, what are all the churches for? And who is Jesus dad?
 Pro-Am.
 A woman shouldnt have to be hit by a car, to learn that she may have rabies. But that is where we are in America. And that does not sit right with me. And that is why Im hosting a fun run race for the cure for rabies. To raise awareness of the fact that there is a cure for rabies. A disease that has largely been eradicated in the US. But not very many people know that.
 Hi Stanley, how many sponsors so far?
 Come on man, gotta step it up! Its for a good cause. Jan called this morning and pledged $500.00.
 That... is for a good cause. Phyllis, hows the rabies quilt coming?
 Oh, look at that, 3. Way to honor Meredith, Phyllis.
 Yes.
 OK.
 Alright, alright.
 Shhh...
 I know that youre probably scared of people seeing your fat legs in shorts.
 OK, well back in olden times, a large fat person, like this, was a person of power. A person who had money, could buy food, person of respect. Like the regional manager of the day. Whereas, someone athletic and trim, like myself, was someone who worked in the fields... And I was a peasant.
 Well, youre going to have to run, or youre going to be in a lot of trouble. It is not olden times anymore.
 We have raised, almost $700.00, most of it from me and Jan. Um... when do they put that on the giant check? Or is that something that we write in later?
 Hmm... Thats a tough decision. Um... I always imagined it with a giant check. So...
 Yep.
 You didnt contribute very much. I was also hoping to hand the giant check to a rabies doctor. And hows that been going?
 What about a rabies nurse?
 Thats possible. Look into that.
 Have you met that kid? Hes not going to college.
 Come in.
 Hey, hey, hey
 What are you doing?
 No I didnt, just please dont...
 May I enter the room?
 See how I did that. Thats the way you should enter a room. You knock and then you wait for the all clear.
 Yes, but I have an office, so why would I do that.
 European offices are naked all the time.
 Besides my shirt tail covered most of it so...
 Thats not gross, it is the human body. What is your problem? Pam youre an artist, right? Think of me as one of your models. OK, you know what, I dont want this to detract from what we really need to be thinking about today, its not fair to people with rabies. And thats the point, right? OK, lets go have some fun.
 Check that out.  Look at me, Im Toby, Im stretching, I know what Im doing. Why is he even here?
 OK everybody, listen up. Thank you for coming. Before we get started I wanted to say a few words about this deadly disease called rabies. And Id like you to take a look into the face of rabies.  That should scare you. It scares me. You people need to educate yourselves. Myth 3 Americans every year die from rabies. Fact 4 Americans every year die from rabies. How many of you know someone who has been afflicted or affected by rabies? Show of hands. One, two, three... too many to count. It is truly the silent killer. No, it is the foaming barking killer. And it is something... Darryl what are you doing.
 No, dont give him... just, did you hear anything I said?
 Hes happy because hes insane. You know what, thats the perfect example of the kind of awareness we need to generate. Wheres the nurse?  This is the reason were here.
 Oh hey, I know you... Elizabeth?
 Right? Wow, very cool you went back and got your degree. I would like you to accept this check, for $340.00 made out to science. Make sure that, that gets into the right hands.
 You got it?
 OK, fettuccine alfredo, time to carbo-load.
 Just remember folks, its not about winning, it is about finishing.
  Beow!
 On your left!
 I am fast! Im very fast! Im like Forrest Gump, except I am not an idiot.
 No, no water for me. Not while rabies causes fear of water... solidarity!
 Rabies victims... have to live with an irrational hatred of water their entire lives. So... least I could do.
 That fettuccine is sitting in my stomach like a rock.
  Excellent! ...Simpsons. Wait, Imodium or Ex-lax?
  Oh God, Oh, alfredo sauce. Im getting a stitch.
  Take bat bites seriously. Dont get bit.
  I am not going to finish. I cant beat rabies. Nobody can beat rabies, rabies has been around for a thousand years. I was a fool to think that I could beat it.
 I cant finish. I feel so weak, I just...
 What do you want me to do Jim?
 No, There are people all over the world, who have all sorts of problems and afflictions, and diseases. Theyre deformed, and theyre abnormal, and... theyre illiterate and ugly. Symphonies dont have any money. Public TV is bust. I cant do anything about it, I cant... you know. Theres just one of me, and theres a thousand of them. And rabies wins.
 Thats a good deal.
 Pam, if everybody felt that way, nothing would get done.
 You just dont think I am capable, of making a difference.
 You dont, you dont know me. Youve just seen my penis. I can make a difference, remember, Im the one who started this whole thing off by hitting Meredith with my car. And I owe it to her to finish this... GD 5k  No, no!
 Finishing that 5k, was the hardest thing I have ever had to do. I ate more fettuccine alfredo and drank less water, than I have in my entire life. People always talk about triumphs of the human spirit, well today I had a triumph of the human body. Thats why everybody was applauding for me at the end. My guts and my heart, and while I eventually puked my guts out, I never puked my heart out. And Im very, very proud of that.
 Hey Mer. How ya doing?
 Its ironic isnt it? I mean Im in the hospital for not getting enough water, and youre in it for a disease that causes the fear of water.
 Thanks, Im not mad at you anymore.  Wanna share?
 Im not really sick.  Nah, Im good.
 Hey Toby. Whats this?
  I just want to remind everyone about the company rules involving PDA or public displays of affection.
 Oh really.
 Is this about me and Jan? In my office? Because I will have you know that that was consensual. What we did has nothing to do with you or anyone here. I dont think. I dont think anyone heard anything. We were very discreet and, and most people had left by that point. So I dont think its any of your business. What I think you should do is roll up the memo, real tight...
  No way.
 Woooah! Wow!
 Awesome!
 You guys! Yes! Yes!
 Oh kay, mind is exploding. Get over here.  Come on. Come here. Okay, okay,  stand up.  OK, here we go.  Everyone, this is a day that will live in infamy. Because today, is the day that Jim and Pam become one.
 I love you guys, so much.
 No, no, no Pam let em ring. Let the bells of Dunder Mifflin chime out your love. Because this is  really good, this is really good. My heart soars with the eagles nest.
 Hey. Can you make that straighter? Thats what she said.
 No.
 Blowing up balloons I thought.
 Pam and Jim are together. Ryan is visiting. Only thing that could make this day better is ice cream.
 Hey!
 There he is! There he is! Hes back! And hes with a beard.  He... He has facial hair. Look at him! All grown up and no place to go. Hello, Mr. Sunny Crockett. Im Tubs.
 Ohh, yeah, lets get started because uh, yes, cause uh this is very serious business and umm..
 ...business meeting --
 Thats right! Thats right!
 Fire guy. Dont start any fires, Ryan.
 Look how big he is. Look at you, you are so mature and old and little man now. Youre like our little man...
 Beard.
 Oh, wow!
 Thats a little kinky. I dont swing that way.
 Woooo! I think Ryan has a gay crush on me.
 Yes, everybody, come on. Settle town. Lets get serious here. Um Ryan, has a very special, important presentation to do, which we will be doing in the conference room in  10 minutes?
 Sounds good. OK, alright.
 Yeah, Ryan snapped at me, but there was this twinkle in his eye that I picked up on, which said, "Dude, were friends. Im doing this for appearances. I am the big boss now. And I have to seem like an ogre. But you know me and you trust me. And we like each other. And well always be friends. And I would never take you for granted in a million years. And I miss you, man. And I love you." His words.
 OOhh. Gimmme, gimme, gimme, gimme, gimme, gimme.
 Ryan Howard everybody.  Good job.
 Who is?
 I am not old. You are old. You are like a hundred.
 Yeah, kay. I was just... After the presentation, just wanted to make sure, that vis-a-vie, that everything in the office is business as usual?
 Yeah, I know I understand... were making great strides and were updating, but business as usual, no?
 Good, so, were on the same page?
 We had a foreign exchange student live with us when I was young. And we called him my brother. And thats who I thought he was. Um, then he went home to what is now formerly Yugoslavia, taking all of my blue jeans with him. And I had to spend the entire winter in shorts. That is what Ryan is like. A fake brother who steals your jeans.
 Hey.
  Hey, what is the actual deal with these things in terms of testicles?
 I dont want to grow weird sperm in case we ever want to have kids.
 Oh, I dunno, theyre launching a big new business plan. New website, blah blah blah. Hes being a real twerp about it, so, its all about youth, and agility and streamlining and trying to squeeze out the older people.
 Well...
 What is that... word?
 So older people have just as many rights as younger people?
 Good, were all here, we can get started.
 Have a seat.
 Have a seat. Like everybody else.
 Still my office, Ryan.  Well, there has been a lot of talk about new ideas today. Well, new ideas are fine, but they are also... illegal, because they are a form of ageism. What? Yes, I am right. Did you know that the Age Discrimination and Employment Act of 1967 prohibits employment discrimination based on age with respect to employees 40 years of age or older? I did.
 Hey, shut up Toby. Look, why do we as a society hate old people so much?
 No, Creed, no they are not. In fact, many cultures revere old people because of their storytelling ability. Like the old lady from Titanic.  Or the funny things that they can do, like "wheres the Beef?"   Yeah.
 I was going to put up some new pictures, but umm, all of the ink in the printer was gone.
  That is me. Come on in.  Who is this old fart? Did you just stagger off the street? Out of a box or something? Whos this worthless bag of bones? Well, this guy is none other than one of the founders of Dunder Mifflin, Mr. Robert Dunder. Huh?
 Sure thing.  Scuse me.
 Fine. Then I will call David Wallace and you can explain to him why you threw the founder of the company out on his ancient butt.
 Bob, how old are you?
 Eighty-seven years young. And still active. That is great. Did you know, that Bob is still a member of the Board of Dunder Mifflin?
 Ah, still sends his own proxy. Good for you.
 Wow.
 Oh, boy.
 Great.
 Great.
 Thats great. Thank you for coming in.  Robert Dunder everybody.  Thank you. That was wonderful. Do you have a ride?
 Perfect.
 Inspirational. What have we learned?  Well, we have learned that you cant teach an old dog new tricks, because its illegal, and you will go to jail.
 No, No. Dont help him. He doesnt need help, Pam.  What a nice guy.
 Good night guys.
 I disagree, I think it was very valuable.
 I happen to think the old ways of doing business are better. And I can prove it.
 Smell that. Do you smell that?
 No, Dwight. That smells like good business to me. What I have done here is I have collected all the finest gourmet items that Scranton has to offer.
 Yes, no! No, those are for our clients. Actually, our exclients. Ill explain, later.
 Ryan wants everything in our company to be about emails and IMs, but I think hes forgetting about the original instant message. Letters attatched to baskets of food.
 Hey boss, I didnt know you were coming in today.
 I am glad that you asked, listen up everybody. In the last year, we have lost seven clients to the big chains. These gift baskets are our ticket back into their lives. We are going to show up at these businesses unannounced, and we are going to win them back.
 With peanut brittle, with macadamia nut cookies, with chocolate turtles, with raspberry jam and a little bit of fat and salt because you know what? Thats what people like.
 Ever since I was a kid people have been telling me I cant do things. "You cant be on the team", "You cant move on to second grade". Well, now theyre telling me that I cant win back clients using old fashioned business methods.  Well see about that. And FYI, I eventually aced second grade, and I was the biggest kid in class.
 OK. Were gonna split up into teams. Jim, Phyllis. Stanley, Dwight. Me Andy.
 Why dont we just go as teams to demonstrate our teamsmanship?
 Yes?
 OK, thats not helpful Phyllis.
 Gift baskets are amazing, Phyllis. Gift baskets are... the essence of class and fanciness. They are the ultimate present that a person can recieve.
 Fine, Im just going to go by myself, and I am going to win them back by myself because this is important to me.
 No, this is my quest.
 Fine. Then God speed. To both of us.
 We dont need luck.
 But thank you, that was really nice of you to say.
 Business to business. The old fasioned way. No Blackberrys, no websites. I would like to see a website deliver baskets of food to people.
 It is in the body shop. Had to have the dent taken out of the hood where I hit Meredith.
 I know. So whos next?
 Who?
  Wow, those things are heavy! Theres a lot of stuff in there. We have macadamia nut cookies, um, the honey mustard pretzels. Have you ever tried focaccia crisps?
 Yes we do.
 Well...
 Mmhmm.
 OK, you know what? Just enjoy the gift basket and remember that we provide a personal touch.
 Well just, uh enjoy the gift basket.
 Alright.
  That guy was so... how can they not know how much better we are?
 That is true.
 Yes, she is nuts.
 How do they know? How does this know where to turn? Thats very impressive.
 And the last guy says "No, hairy body".
 Ah, well its still very good. I bet I know someone who hasnt heard that joke... your daughter Emily. Hows she doing?
 Shes gonna be like eleven this winter? Wow, they grow up so fast. I have a few of my own that I want some day. Listen, I dont want to take any more of your time, I know youre a very busy man. The reason we have stopped by is to drop you off this elaborate bag of goodies, and to ask you to reconsider.
 OK, OK! So youll reconsider?
 Ah... .is that all you have to say?
 Look, we want you back.
 Well, no.
 No its not.
 Why would he come back? I will tell you, Dwight. He would come back because we offer a wide selection of products and because youre definitely not getting the same sort of customer service that you get with us.
 Look... were also coming out with a website soon. Its a state of the art thing, itll be up and running, its gonna cut costs and it will make ordering much much easier.
 Great, the magic of the gift basket.
 OK, good. Dont let Emily have any of the cajun almonds, shes alergic.
 I dont get it, I really dont get it. I thought this would work. I do everything I had at that guy and nothing.
 That is a very good point, Dwight.
 No, it said right, it said take a right.
 Maybe its a shortcut Dwight. It said go to the right.
 The machine knows where it is going!
 The machine knows--- stop yelling at me!
 Let go, let go of me!
  You sure youre OK?
 Good, that is whats most important.
 What a disaster, this whole thing.
 These people just dont realize what a gift basket means, they dont get it.
 What about that last guy, Aaron? Is he a jerk. "I dont even know if I want it. Theyre website is so easy". Yeah, well, you can have your technology jackass, look where it got us.
 Hang up.  You know what were gonna do? Were walking back. Were walking back to that office and were gonna reclaim our gift basket!
 Were gonna take whats rightfully ours! Were gonna take a stand, Dwight! Were gonna take a stand!
 Give it back. The gift basket, give it back.
 Yeah, maybe we should, maybe we should leave. Come on, lets leave, but before we leave my wet friend and I are going to wait for our cabs on yours nice couches!
 Look, my clothes are so wet!
 Its been opened.
 Whats missing... the turtles. Where are the turtles? Where are the turtles?
 WHERE ARE THE TURTLES? WHERE ARE THEY?
 May I have your attention please? This office will not be using any new technology ever, starting now.
 Ryan thinks that technology is the answer. Well guess what? I just drove my car into a lake.
 I drove my car into a  lake. Why you may ask did I do this? Well, because of a machine. A machine told me to drive into a lake. And I did it! I did it because I trusted Ryans precious technology, and look where it got me.
 Exactly!
 Maybe, maybe not, time will tell. But I will tell you one thing. Those gift baskets never endangered anybodys lives.  Game set match... point... Scott... game over... end of game.
 Everyone always wants new things. Everybody likes new inventions, new technology. People will never be replaced by machines. In the end, life and business are about human connections. And computers are about trying to murder you in a lake. And to me the choice is easy.
 Hey Toby. Whats this?
  I just want to remind everyone about the company rules involving PDA or public displays of affection.
 Oh really.
 Is this about me and Jan? In my office? Because I will have you know that that was consensual. What we did has nothing to do with you or anyone here. I dont think. I dont think anyone heard anything. We were very discreet and, and most people had left by that point. So I dont think its any of your business. What I think you should do is roll up the memo, real tight...
  No way.
 Woooah! Wow!
 Awesome!
 You guys! Yes! Yes!
 Oh kay, mind is exploding. Get over here.  Come on. Come here. Okay, okay,  stand up.  OK, here we go.  Everyone, this is a day that will live in infamy. Because today, is the day that Jim and Pam become one.
 I love you guys, so much.
 No, no, no Pam let em ring. Let the bells of Dunder Mifflin chime out your love. Because this is  really good, this is really good. My heart soars with the eagles nest.
 Hey. Can you make that straighter? Thats what she said.
 No.
 Blowing up balloons I thought.
 Pam and Jim are together. Ryan is visiting. Only thing that could make this day better is ice cream.
 Hey!
 There he is! There he is! Hes back! And hes with a beard.  He... He has facial hair. Look at him! All grown up and no place to go. Hello, Mr. Sunny Crockett. Im Tubs.
 Ohh, yeah, lets get started because uh, yes, cause uh this is very serious business and umm..
 ...business meeting --
 Thats right! Thats right!
 Fire guy. Dont start any fires, Ryan.
 Look how big he is. Look at you, you are so mature and old and little man now. Youre like our little man...
 Beard.
 Oh, wow!
 Thats a little kinky. I dont swing that way.
 Woooo! I think Ryan has a gay crush on me.
 Yes, everybody, come on. Settle town. Lets get serious here. Um Ryan, has a very special, important presentation to do, which we will be doing in the conference room in  10 minutes?
 Sounds good. OK, alright.
