 No no no no no, yes I, OK, well, alright, heres the deal. Its my fault. This is, this is totally on me. Before you guys came in, I was talking to the guys. We were all chatting and I made a joke, a really dumb joke and Craig the idiot took it seriously.
 I did, it was stupid. And Craig, you saw him, hes not the sharpest tool in the shed. Although he is a tool.
 I know. It was borderline at best and... And Jan is a fantastic executive and has all the integrity in the world and um, Im really sorry. It will never happen again.
 Oh, no big deal. Really. Sorry again.
 Yeah, Happy Valentines Day.
 Oy vey... schmear.
 Lets think this through. If we ask Corporate for that then...
 Could go either way. We dont know what they are going to say.
 Have to think it through. Because if they say no...
 No! Yes, we have to! You know why? Because I dont like to be cooped up in that office! In that box! All day long.  Heisman! Because I need to think. Okay, Jim? Oh, Kevin, oh!  Nice catch. Mmmm, mmm, mmm,mmm. Os-car! Intercepted.
 Give it to me. Phyllis, give me the ball. Ok, give me the ball. Give me, you guys... Creed give me the ball! Right now give it to me.
  Hey, Dwight.
 You all right Ryan?
 Pam!
 Thats what she said!
 Grapes. Seductive. So you ready for the big speech this afternoon?
 Oh! Abso-fruit-ly. Fruit. Grapes. Nailed the joke. Matter of time. Um... And yes, it is a big speech. Biggest of your life.
 Speaker at the Sales Convention. Been there, done that. Went there again, did it again. Two years in a row. Consecutive. I just... I miss the feeling of knowing that you did a good job because someone gives you proof of it. Sir, youre awesome! Heres a plaque. What, a whole year has gone by and you need more proof? Heres a certificate. They stopped making plaques that year.
 That would look terrible. These are mostly salesmen and salesmen expect to be entertained and you are the main act.
 Thats because youre incapable of doing it because you dont know how. Because you have no skills. Dwight, theres no way I can possibly teach you what you need to know about public speaking by speech time.
 But I can teach you enough so that you dont embarrass me or the company.
 Well, if you have a question, you should ask me.
 Dont. Dont try and think of a question to humor me. Just... try not to be such an idiot.
 Insult.
  But seriously, whats the difference between a salesman and a saleswoman?
 Its a joke, Dwight. Its not a Sex Ed class.
 Yeah, youre right about the difference between a man and a woman, but not about the punch line to the joke, right?  The difference between a salesman and a saleswoman... is boobs!
 I do. Both of them.
 No, no! They would remember them. Look, it doesnt matter what you say. It just matters that youre saying something that people care about. Yeah? All right? Here we go. Watch this.
 Attention everybody! Attention please! I have some very great news from Corporate. We had a wonderful quarter and as a result all of you are getting bonuses for 1000 dollars!
  Congratulations.
 You see that? You see how they responded to me? In that moment, I had them.
 No, no! Its not true. I was just talking so just go out there and say anything. Theyll eat it up. Theyre a great audience.
 Hes kidding. Dwight was kidding and I dont know why because it wasnt funny... and it was just horrible.
 Yeah.
 All right. Everybody in the conference room now. Lets go. Lets do it.
 As your leader and your friend, I sort of demand that you can all speak in public as I can... and did... twice.  You saw the plaque, right?  All right. Were all going to go around the room and were going to make toasts. And that way, we will overcome our fear of public speaking.
 Pam! Im public speaking. Stop public interrupting me. Actually, this would be good practice for your wedding toast.
 Yes. Good. Jim taking the initiative.
 Oh ho hokay. You know what? Thats not a toast. Youre not standing up.
 Okay, Dwight. Show us what you have learned today.
 Well, its mostly made up. So...
 Dwight is not going to do a job. Its sad. And theyre expecting excellence because I did do such a good job. Two years in a row. I killed. It was amazing.
 Confidence, Dwight.
 Its time, Dwight. The grim reaper is here.
 All right. You ready? Here we go! Wow. Its a little bit bigger than I remember. Come on. Were down here. Right.
 Dwight, they called your name.
 All right. You know what? Okay. No. No problem. You are lucky you have me here. Im going to cover for you.  All right!
 Gooood morning, Vietnaaaam! I am not Dwight Schrute. Not at all. I am Michael Scott, his mentor and boss. And until Dwight comes up, if he ever does, I wanted to say a few words about excellence. What makes a work environment excellent? Well, there are many things, I believe, that do such a thing of that nature. And one would be humor. What is the difference between a salesman and a saleswoman?
 Im very sorry. I did not know you were wearing a hearing aid and I just thought you were speaking abnormally. ...And now the black guy from the Police Academy movies. A robot.  Michael Winslow, anyone?
 Car starting.   All right, Dwight Schrute everyone.
 Good luck. That is a tough crowd.
 I got thirsty. Howd it go?
 You would not believe what happened here.
 Oh! This woman came in, sat down, ordered a drink. The bartender asked for her ID which I thought was odd because I pegged her at like 35.
 Yeah, it was weird. So, she was like I dont have my ID, please give me one. And he was like I cant do that. I cant serve you.
 She might have been. So she says Fine. I will go to my room. I will get my purse. I will come back. Ill show you my ID. She hasnt come back yet. Shes probably in her room drinking from the mini-bar! Right?
 Dwight gave a great speech. Thats the word on the street anyway. And I entertained Dwight to no end with my bar stories. So, I captivated the guy who captivated a thousand guys. Can you believe that? A thousand guys?
 Pam. Ms. Beasley if yer nastay! Janet Jackson. Hey! You having a wardrobe malfunction there? Or w---
 ... Oh, God is that today?
 Listen, I like kids. But this is not a kids environment. This is like HBO, no limits. Who knows what Im going to say? Crazy stuff. And it is R rated, it is not rated G. I am like Eddie Murphy in "Raw," and they are trying to make me into Eddie Murphy in "Daddy Daycare." both great movies, but, still.
 Well, Ill be in my office.
 Theyre cool.
 Fine, fine, fine, fine, fine, fine, fine. Hi, children. Im Michael Scott, and... I... am in charge of this place... ahh, whatll make you... understand... I am... like Superman, and the people who work here are like citizens of Gotham City.
 Okay, Im Aquaman. Where does he live, guys?
  I work with a bunch of nerds.
 Oh, yes, hello, how are you? Good to see you. Wow, youve really grown up. You know what? Dont mind me saying so, she is turning into a stone cold fox. Better keep the... frat boys away from her.
 Oh.
 Yeah, middle schools amazing. It is extraordinary. An extraordinary time.
 Its not that children make me uncomfortable, its just that, why be a dad when you can be a fun uncle? Ive never heard of anyone rebelling against their fun uncle.
  They want how many spiral pads?
 Okay.
  Just compare last years order to this years. Uh-huh. Yeah, Im looking at it right now.  ... Yes. We--yeah, theyre very--theyre different.  Yeah, we can stick with last years, youre just going to have to supplement it, somehow.
  Yes. Well... we can...  uhm... hey, uh, you know what? Can I call you back? Ill call you right back. Yes, I promise. ...Hello, can I help you? ... You can pick that up, if you want. Thats--- thats alright.  Want to bring it over... here, make some room. My names Michael. Whats your name?
 Nice to meet you.
 Oh, you know what that is! That is a train whistle, like Im the conductor.  But Im sort of the conductor of the office here, right?  You want to try?
 All aboard for sales! Next stop, Cu...camonga!
 Dwight! Dwight!
 What the hell are you reading to them?
 Yeah, you know what? No, no no no no. They, no. The kids dont want to hear some wierdo book that your Nazi war criminal grandmother gave you.
 Whats a Nazi?
 Dont!
 Dont! Dont! Dont talk about Nazis in front of--- you know what? Theyre going to have nightmares, so why dont you just shut it?
  Why dont you just leave? Okay?
 Alright. There goes Mister Poop. Now, who likes Dane Cook?
 Children cannot lie. They are innocent, and they speak the truth, and out of the mouths of babes, Michael Scott is freaking cool.
 This is where the magic happens! Right over here, let me show you this. See all these?  You know what that is? Thats paper. This is where paper comes from. Any questions?
 No, we dont actually cut the paper. Thats a good question. The paper is sent to us cut, and dyed, from a paper manufacturer, and then we sell it to a business for more than we paid for it.
 Yes it is, well, w-w--you need someone in the middle to facilitate...
 Im not just a middle... man...
 You are describing Office Depot, and theyre kind of running us out of business.
 ...Theres Creed! Lets take a look at what hes doing, everybody! This is Creed, and he is in charge of... something. Right?
 Say hi to the kids.
 Yaaaaay.
 What are you doing? N--stop it! Stop it! Just--no, no, no, no! No! Would you cut it out?! What is your problem?
 No no no, were not gonna see--- were not gonna see the four toed... Creed, okay?
 You know, theres something interesting about me you might want to know. I ... used to be ... the star of a kids show.
 Its true. I did.
 I am totally serious. There was a show called Fundle Bundle and I was the star.
 Its true! I can prove it! I can prove it, watch this.  Ryan, can you come here a second?  I would like you to go to my mothers house in Dickson city, and if she is in the pool, the back kitchen window should be unlocked, I want you to boost yourself up, I want you to go down to the basement. In the basement is a tape labeled Fundle Bundle. I want you to grab it, I want you to get my guitar.
 I want you to get the tambourine. Do you know how to play the tambourine?
 Oka--
 Okay! Thank you Ryan. Good attitude, hottest in the office.
  Alright, nowwww... what kind... of pizza do you like?
 I dont get why parents are always complaining about how tough it is to raise kids. You joke around with them, you give them pizza, you give them candy, you let them live their lives... Theyre adults, for Gods sake.
 I am going to give you a little blast from the past of Michael Gary Scott when he was a child star, and a show that you might remember called Fundle Bundle. Okay? Without further ado, Ryan?
 That... is Miss Trudy. Cant tell from the costume, but she had an amazing body. Okay, you can... fast forward. And... I want you... to...
 Stop! Stop! Stop!  Yes! That is, uh, Edward R. Meow.
 Yeah.
 Uhh, I dont know.
 Can everyone please shut up, please! So you dont miss it.
 Oh! Thats me. Shh. Shh.
 Coulda sworn there was...
 ...uh, no.
 Uh, just never happened.
 Uh, nope.
 I do okay.
 Yes.
 Okay! Alright, okay.
 ...I guess not... you know, I have a load of work to do so I am going to grab a slice of this delish pizza... and Im going to go do my work. Bye.
  Yeah?
 Oh, thats okay, she can keep those.
 Thank you.
 You have to ask me that because you work for human resources.
 Well, sure, playing the field is great, dont get me wrong, but theres more to life than notches just on my bedpost.
 Tell me something honestly, do you... think... that it is too late for me to have kids?
 What about...
 ...Jan. Kay.
 ...Or biologically.
 Thanks, thats, no, that... that really means a lot to me. Hey, does Sasha have a godfather, because I...
 Oh... kay.
 Yes, it is true. I, Michael Scott, am signing up with an online dating service. Thousands of people have done it, and I am going to do it. I need a username. And... I have a great one . Little kid lover. That way, people will know exactly where my priorities are at.
 Hey, uh, no, please? You cant leave yet. Theres still one more thing we need to do.
  You... who are on the road... must have a code... that you can live by...  and so... become yourself... because the past... is just a goodbye... and teach... your children well...
 One more time.  You...
 So, Phil recruited me to sell these cards, and now I am recruiting you.
 Dont worry about Phil. He drives a corvette. He is doing just fine. Okay. Calling cards are... the wave of the future. These things sell themselves.
 You know what? Thats a nice attitude, Ryan, Im just helping you invest in your future, my friend.
 Yes! Thank you! You will get rich quick. We all will!
 You know what, Toby? When the son of the deposed king of Nigeria emails you directly, asking for help, you help! His father ran the freaking country, okay? ...Alright, so, raise your hand if you wanna get rich.  Alright.
 Alright, let me explain. Again.  Phil has recruited me and another guy. Now, we are getting three people each. The more people that get involved, the more who are investing, the more money were all going to make. Its not a pyramid scheme, it is a... its not even a scheme per se, its...  ... I have to go make a call.
 Oh ho ho! What?
 Thank you! Thats really nice.
 Today is my B-day, and people around here just go crazy for it. I dont know why. Oh! Fun fact. I share my birthday with Eva Longoria. So, I have a
 Whats up?
 Ah, thank you sir.
  Yeah.
 Ohh, god.
 No no no, no, new suit, please.
 Thank you very much. It is from Italy.  Actually--- no, Bulgaria.
 Good luck. One of a kind.
 Not necessary, the party planning committee is all over it.  Theyve been working twenty-four seven all day yesterday.
 Dont! Nope! Please, dont want to spoil it for anybody. Spoil the surprise.
 Lets get the party started.  Not the way I taught you!
  Yeah?
 Oh, great, put her through.
 Hey, you.
 It is urgent, I just wanted to call and wish you a happy birthday.
 Really? Cause, I thought we had the same birthday.
 Thanks.
 Nope. Totally private. You can say whatever is in your heart.
  ...You can take a five, if you want.
 Somebody brought in donuts for my birthday!
 Thanks.
 Somebody got donuts for my birthday!
 You didnt know it was my birthday.
 Well, I guess I forgot to give you a donut .
 Mmm.
 Here we go. Ohhhkay, this is great!  Thank you my friends, she is perfect! Ahhh, Dwight, may I have your chair please? And, um, some singles, if you will! Allllright. Nnnnn-dink!  Okay, um, alright. This has arms. Is that gonna be a... is that alright?
  Okay. Im so nervous.
 When I was seven, my mother hired a pony and a cart to come to my house for all the kids... and... I got a really bad rash from the pony, and all the kids got to ride the pony and I had to go inside, and my mother was rubbing cream on me... for probably three hours, and I never came outside. And by the time I got out the pony was already in the truck. And around the corner. So that was my worst birthday.
  Stop it. Stop! What is that?
 Yeah, well, its on the radio. My birthday blows. Nobody even signed my birthday poster. Probably my mother is the only one that cares enough to send me anything.
 Youre making it worse. I bet Luke Perrys friends dont treat him like this .
 What?
  Ohhh, God.
 Ohhh, no.
 Ohh, no, no, no! I cant... Ryan, come on. Lets do this.
 Okay.
 Thank you.
 Whoa whoa! Alright. Alright. Watch it... please.
 Get in here... everybody.
 Birthday party subs! My gift to you.
 The best.
 Yes.
 Well, then just have the tomato and ketchup. Still good.
 Just the bread, its fresh baked.
 Mm-kay. Get whatever you want.  And choke on it.
 When I was sixteen, I was supposed to go out on a date with a girl named Julie. But there was another Michael in the class that she apparently thought the date was with, so she went out with him, on my birthday. And, she got him a cake, at the restaurant. And it wasnt even his birthday, but I heard about it the next day in school. So...
 Kevin? Respect the birthday please.
 Are you done? ...Good. Okay.
 Uhhh... blow out the candle. Okay. Mmmm...
 ... I asked for trick candles.
 Okay. Well, when she comes back well do it again.  Hello, what about the birthday boy? Havent had a hug all day.
 ... Aww, that... sucks, great. ... Wow, thats good timing. Thats... thats, sorry, thats terrible. Terrible news. Thats terrible... terrible news for both of us .
 There you are. Good news. Did some research. It turns out that 98% of people with skin cancer fully recover.
 Yeah, but its not brain cancer. And it shouldnt stop us from having fun. You know what they say the best medicine is.
 And laughter... also.
 Why are you here? I didnt even invite you to my birthday party.
  Nyeh, I work here.  Alright, well, you know what, since Toby doesnt speak for everybody and I am your boss, I... think you should just go home. Take the rest of the afternoon off. Take a sick day.
 Well, youre pretty much driving everyone else here crazy... crazy with worry.
 Excuse me, everyone. Attention please. Kevin, were going to take you to a very special place, a place that will make you happy, and a place that is far, far away from the evil sun.
 How dare you sir. You are gross.
  That should not be there.
 No, its alright. Its already up. Just leave it. Wheres Kevin? Come on! Lets get our skate on!
 Yeah, Ive been pretty much skating my whole life. I thought about playing in the NHL, but, youre on the road so much. You got no time to spend with your wife and kids. And I really want a wife and kids.
 Hey Pam, all this stuff with Kevin... um, its pretty scary. And Im thinking that uh, next time youre in the shower, you should check yourself out. You know, give yourself an exam. Those things are like ticking time bags. Alright? Think about it.
 Kevin. You heard anything yet?
 Okay. Well. Live strong.
 Alright.
 Yeah. Carol? She sold me my condo! Hey! What, is this place on the market? Or...
 Oh, these... all your kids?
 Oh, hey guys. Whats up? You wanna go for a ride? Is that okay?
 Cool. Alright. Grab on. Here we go. Ready? Hang on tight. Alright. We are moving. We are reaaallly mooovin now!
 Push. Good! Thats great. You got it.  Excuse me.
 Oh... God...  God!  Were gonna beat this, okay? Were gonna... come here .
 Well, apparently in the medicine community, negative means good. Which makes absolutely no sense. In the real world community, that would... be... chaos.
 Okay, whos this from? Wowwwee, look at that! Jersey!
 Cool. Ohh. Great. From Dwight.
 Thank you... Dwight. Thats great. Thanks.
 Yeah.
 Oh! You didnt need to do that. ...Nightswept. This is... really amazing. Thank you. I love it.
 Ry, is he bugging you? Dwight, dude, you gotta take a chill pill, man. It was one joint in the parking lot. You know, youre totally harshing the office mellow.
  Narc!
 I wasnt attempting to compliment you.
 Uuf, well...
  Okay...
 Why dont you just cool it, cool it Dwight, please, God!  Dude, wheres my office?  I totally lost it, cause I was half-baked. Smokin doobies. Doobie brothers, I was smokin doobies with my brothers. Peace out, Seacrest!
 Thanks. M-m-munchies. Who wants some munchies?
 Uh-oh. Uh-oh. Whos he calling?  Ratting somebody out.  Narc!  Narc!  Kevin?
 Remember the narc bit?  Uh-oh, whos in trouble?
 Waa... what? What are you talking about?
 Two nights ago, I went to an Alicia Keys concert at the Montage Mountain Performing Arts Center. I scored these great aisle seats. Anyway, after the opening act this beautiful girl sits down next to me and I never get to meet girls with lip rings and she had one. I dont know exactly how this happened but one of her friends started passing around some stuff and they said it was clove cigarettes, and Im sure that it was clove cigarettes. Everybody in the aisle was doing it.
 Okay, attention everyone the drug testing has been cancelled.  Instead, I will be going around to each of you and doing a visual inspection.
 I can do that, it is my office.
 It has come to my attention that some people here think that the use of drugs is something to laugh about.
 No, uh, no. That was a test.  I was testing you, and you all failed. Miserably. When I said that Dwight was a narc, how many of you defended him?  How many of you said, "Hey, you know what, hes right? What hes doing is protecting this office from the evils of drugs."
 I am ridiculously anti-drug. So anti-drug that I am above suspicion in any way that involves suspicion, or testing of any kind.
 Drugs ruin lives people. Drugs destroy careers. Take Cheech and Chong everybody knows that Cheech and Chong are funny, but just imagine how funny they would be if they didnt smoke pot.  I want everybody to take a look to their left. Now I want everybody to take a look to their right. One of those people will be dead from drug use at some point in their lives. This year more people will use cocaine than will read a book to their children.
 Are these facts scaring you, or are they not?
 Do you think that smoking drugs is cool? Do you think that doing alcohol is cool?
 Okay, enough, enough, enough! I have written down a list of illegal drugs. Take a gander. How many of these are you familiar with?
 Yes it is.
 Okay, you know what, Toby? Pam, can you take this down?  In addition to Tobys urine being tested, I would like to test his blood and his hair.
 I can test anyone randomly, and I have chosen you randomly.
 Okay, eeny, meenie, miney, moe, is random.  Okay, you know what? Im going to need a volunteer to select one of these words and tell us of something tragic that happened in either their lives, or the lives of a loved one.  Yeah, Pam.
 Really?
 Jim its okay. You can t...  This would be a good place to let it out, Jim. These are people you can trust. These are people who care about you.  Its okay, just we will not judge you. We are here to not judge you.  Oh, hes doing it, okay.  Its okay.  Oh. Okay, are you sure?  That looked like it was going to be good. Alright.  Okay, well.
 The point Im trying to make with all of this people is that I hate drugs. I hate them, and based upon what I have seen you all dont quite hate em as much as I do so you are going to have a drug test, and I am not.
 Yes, I will not be.
 Okay, well Dwight just know that Ive been very busy today and I got a lot of work to do and I wasnt planning on going to the bathroom and I dont even know if anything is going to come out, okay? So good. Thank you.
 So I need you to do some work on the St. Andrews account. I need your urine. I need some filing done.
 Just forget it.  Just the urine.
 Just. I need your urine.
 Yes in a cup, were not animals, Dwight.
 Its none of your business.
 Okay. Alright. Just, I went to an Alicia Keys concert, over the weekend, and I think I may have gotten high accidentally by a girl with a lip ring.
 I need clean urine for the lady.
 Dont think of it that way. Its like, urine goes all over the place. You know, theres no controlling it. It just... goes
 A cup could find its way under the urine. It might be an accident. It happens.
 No, just look. Look. Just... just fill up the cup.
 Dwight. Well, I passed the test thanks to you and your untainted pee. Thank you very much.
 Whats wrong? Wheres your costume?
 Why?  Wha...
 Since you did such a good job with the investigation, I decided to pull a few strings. Call in a few favors. and Ive decided to make you official security supervisor of the branch.
 Yes, sir.
 So you wanna? Thanks.
 Okay.
 Good.
 No. Oh. Uh...
 Alright.  Well, Thank you.
 Yes, thanks, Fantastic Sams. Adult Cut Plus. Comes with a shampoo and blow dry. Were doing I.D. photos today. Gotta represent.
 Thats a nice tie.
 That is... who makes that?
 Do you mind if I wear that for the photo?
  Whats the dealio?
 Whats the problem?
 So what, youre having a little spat. I forget, are you guys dating?
 Yes.
 Yeah?
 Okay.
 What do you know about conflict resolution? Your answer to everything is to get divorced. So...
 Okay... what?
 Yeah, well... thats not gonna fly here. Because in this office, it is till death do us part... assuming we dont get downsized.  Uh, Pam, will you get Angela and meet us in the conference room please?
  A mediators tool chest. Okay, well, before we get started, you should know that are 5 different styles of conflict. My Shaolin temple style defeats your monkey style.
 No. Okay, this is important. The first style is lose/lose.
 Just hold on, please! Okay, if we do lose/lose, neither of you gets what you want. Do you understand? You... you would both lose. Now I need to ask you, do you want to pursue a lose/lose negotiation?
 Win/Win is number four and number five is win/win/win. The important difference here is with win/win/win, we all win. Me too. I win for having successfully mediated a conflict at work.
  Okay, since this is the disputed poster. Now, one at a time, I want you to express your feelings using "I" emotion language and no judging or "you" statements.
 Come on, seriously, that?
 Okay, okay. Stop, stop, stop! Lets see if we can just brainstorm and find some creative alternatives that are win/win.
 Yes. Thank you, Pam. How about Angela makes the poster into a t-shirt, which Oscar wears. That way, he can never see it and whenever she looks at Oscar, she can see it. Win/win/win.
 Okay... well, brainstorm. Own the solution.
 Okay, that is called a compromise. And it is style 3. And it is not ideal. To sum up, win/win - make the poster into a t-shirt, win/lose - take the poster down, compromise - Tuesdays and Thursdays. And the answer is... make the poster into a t-shirt! Win/win.
  It is done!
 Yes.
 Are those all the other complains?
 I would like to see those please.
