 Yeah, save your heart for love, and use your brain for business, right? If we dont do this to prince paper, someone else will. Worse yet, someone else will do it to us.
 There was a terrible war, ugh, so many died. Far too many died. But if Frodo hadnt destroyed the ring, then goodness itself might have died.
 Yeah.
 Good, so,  where are you going?
 Where are you taking the client list?
 Michael, Michael, no. Michael, give that. Michael, dont do this. No.
 Freeze, give me the list!
 No no no, I cant let you do this!
 Its business, not personal.
 Its over, Michael, its over.
 Guess whose stock just went up, golden boy?
 Last week I gave a fire safety talk.  And nobody paid any attention.  Its my own fault for using PowerPoint.  PowerPoint is boring.  People learn in a lot of different ways, but experience is the best teacher.   Today, smoking is gonna save lives.
   Does anyone smell anything smoky?
||
  Oh, fire!  Oh my goodness!  Whats the procedure?  What do we do, people?
 Oh, how did that happen?
 No, we dont know that.  The smoke could be coming through an air duct.
 Whats the procedure, everyone? Whats the procedure?
 Wait, wait, wait.
 No! No, Michael! No!  Touch the handle.  If its hot, there could be a fire in the hallway.
 Not a viable option.
 Okay, whats next?
 Oh! Heres a door.  Check that one out. Hows the handle?
 Well, uh, another option.
 Back to our options. Jeez! Ok! settle down everyone.  No bunching!
 Things can be replaced, Phyllis! People, human lives, however, can...
 Okay, lets go.
 Calm, please
 Have you ever seen a burn victim?
 Okay! Procedure, procedure. Exit options.  Where do we go folks?  Wha-- Use a what to cover the mouth?
 A what?  A rag.  A damp rag, perhaps.  Lets remember those procedures.  What are the options?  Okay, thats the wrong way.  Weve already tried that.  Remember your exit points.  Exit points people.
 Whats next?
 How about 911?  Anyone? 911.
 Use the surge of fear and adrenaline to sharpen your decision-making.
  Attention everyone! Employees of Dunder Mifflin!  This has been a test of our emergency preparedness.  There is no fire.  It was only a simulation.
 Fire not real.  This was merely a training exercise.  So, what have we learned?   Oh come on.  Its not real Stanley. Dont have a heart attack.
 A lot of ideas were not appreciated in their time.
 Shampoo.
 I just want to say for the record, I did not kill anyone.  Stanley was attacked by his own heart. And he should be released from the hospital and back in the office in a couple days.
 Yes I shouted "fire!".  I shouted many things! I also shouted instructions on how to get out of the building, so you can imagine my frustration as safety officer when nobody would heed of what-- heeded--
 When no one hedded--
 N-no one would take hedded of my instructions.
 So, you--
 And, well, I dont see my co-workers--
 Hee-heeding this right now.
 No.
 PETA.
 Well... I guess we papered over that pretty nicely.  It always amuses me when corporate thinks they can make some big change with a twenty minute meeting in some fancy high-rise. Whats the matter? You hungry?
 Dont you worry about that.  I got it covered.  Okay?
 I am planning a bomb scare that should really get the blood pumping.
 What? You?
 Come on.
 Thats preposterous.
 This is a farce. I should be teaching this course.
 Absolutely I would not.
 Okay, hes dead.  Anyone know what we do next? Anybody? Rose?
 Anyone else?
  Wrong. Ehh. Check for an organ donor card.  If he has one, we only have minutes to harvest.
 He is.
 Get me some ice and a styrofoam bucket.  Here we go.
 We search for the organs. Wheres the heart? The precious heart.
 Clarice?
 I didnt think it was very realistic in the movie and it turns out, its pretty realistic.
 Wow.
 I have.
  "I state my regret."
 I could not, because I do not feel it. Okay, everyone. I am going to need you to sign this statement of regret as an acknowledgement that you heard it.  Okay? Everyone come on up here. Its not a big deal.
 Yeah, right. I filled him full of butter and sugar for 50 years and forced him not to exercise. Now, take a lesson from Stanley and jog on up here and sign this, okay?  Make a line. Just form a line right here.  Sign it!  Sign it now!
 Nothing stresses me out. Except having to seek the approval of my inferiors.
 Speaking of which...
 May I have your attention please? Sign in, sign in on the sign in sheet, the clipboard. This meeting is mandatory, if you do not sign in your name will not be counted. Thank you.
 That was the last signature I needed.
 How dare you all attack him like this.
 Michael is your superior.
 Okay, you should be bowing down in front of him.
 Ok, no, they dont understand who they have...
 Youre interrupting me. Im trying to get your back.
 Are you calling me an idiot?
 Dont you ever talk to me that way. You pathetic, short little man. You dont have any friends, or any family, or any land.
 Its very unusual for Michael not to show up to work. My guess? Hes either deeply depressed, or an icicle has snapped off his roof and impaled his brain. He has this terrible habit of standing directly underneath them and staring up at them. And I always say Michael, take two steps back, and stare at the icicle from the side. And hes like no, I like the way they look from standing directly underneath them.
 Attention everyone I just got a text from Michael. He says personnel day. Are we hiring?
 Oh, thats quite a leap Pam.
  Got it.
 Hey. Why are you wearing a turtleneck?
 Excuse me, that is no way to address a superior.
 Go ahead, you do it.
 I insist.
 What he said was...
 ...there was a problem with having one head of the party planning committee. She becomes too powerful, so he appointed two heads.
  I am a paper salesman, this is humiliating.  Thats on my side.
 If you say screw you one more time...
 Hey, HEY.
 Oh God.
 What kind of cake do you want imbecile.
 Well, Im not done yet.
 They match the carpet
 Its a statement of fact.
 This is more professional. Its not like she discovered a cure for cancer.
 Are you trying to hurt my feeling? Because if so, you are succeeding. Fortunately, my feelings regenerate at twice the speed of a normal mans.
 Have you collected the money from everyone?
 How much do you have?
  Thats how much you and I contributed! I... Damn it Jim!
||
  Damn it!  Dwight Schrute.
 Who is this?
 Mose doesnt know how to use a phone. So jokes on you.
 Uh, 24. 37.
  Ill call you back.
 I have here Kelly Kapoors personal and confidental file. Allow me to share.   "Kelly Kapoor spent April 1995 to December 1996 at Berks County Youth Center." Juvie. "According to past employers, it in no way affects her job perfor..."  Blah, Blah, Blah.
  What did you do?
 What did you do?
 What did you learn in there? I bet you learned things, huh? Like how to fashion a shiv, hmm?
 Why dont you tell Jim where you were from ages 14 to 15.
 In juvie.
 Juvie... nile... Detention Center. Where they send teenagers!
 For reha-
 What did you do? Huh?
 Yeah, if shes old enough to get married, shes old enough to follow the law.  What did you do?
 I thought you said yesterday was your birthday!
 Frosting.
 Nice job on the cake, Bozo!
 Busy!
 Oh, my God. Is this how you are with Pam? Cause she must want to shoot herself in the face.
 You know what? Im a little busy.
 Its not effeminate. Its festive.
  You have to write my suggestions down, too.
 Its in the name.
 Youre right, forget horse hunting. Its stupid.
 Heres one. It was dark, warm, wet. A sudden burst of light. An intense pressure like Id never felt before. Father, dressed in white, pulls me forward. Mother bites the cord.
 Schrutes dont celebrate birthdays, idiot. It started as a Depression-era practicality, and then moved on to an awesome tradition that I look forward to every year.  What about you?
 Thats cool. Hey, you know whats even cooler than triceratops? Every other dinosaur that ever existed.
 Hey, its not a surprise.
 Told you.
 Our theme, if you will.
 Thats our theme.
  Oh, yes! Okay, good. So whats it gonna be, Kapoor?
 No.
 Okay, nap it is! Everyone out! Get out! Were gonna be eating cake at our desks. Lets go.
 Move it! Lets go, go, go, go, go. I got this.
  Okay, youve got one hour.
 Mm, great cake.
  Birthday time is over! Now go make up for all the work you missed when you were taking your nap.  Many happy returns.
  Ayyyy!
 So sexy it becomes hostile.
 Yeah, deal with it Pam!
 Having trouble finding a vein?
 How about now?
 I train my major blood vessels to retract into my body on command.  Also, I can retract my penis up into itself.
 Youre right.  OK everyone,  back to work.
 A net? a giant net?
 What do you have in mind?
 Oh God, thats a terrible idea.
 No.
 Lonely people mixing with one another?  Breeding? Creating an even lonelier generation?  Ha, youre not allowing natural selection to do its work.  Pssh.  Youre like the guy who invented the seat belt.
 Hey.  No movement.
 Eh, its not that early.
 Im ok.  Feel a little lopsided because of all the blood they took out of my right side.
 Oh.  Meh.
 Eh.
 Hello.
 Dwight K. Schrute. Why dont you introduce me to your little friend?   Hi, Dwight.
 I can untie any knot.  Im serious.  Name a knot, any knot.  Go ahead.
 You shouldnt believe everything you hear.  In fact, there are many knots that I cannot untie.  So where does a woman as charming as yourself find herself employed on a day such as today.
 You must use a lot of paper.
 ...and the kind of discounts were talking about are not... hold on - Michael, Why do you keep looking at the front door?
 Is somebody after you?
 Hey, it just takes one!
 Oh, not likely.  3 billion woman on the planet, most of them live in Asia so the numbers just dont add up.
 So basically, the greater volume you decide to buy in, the greater discount we can give you.
 OK, whats up?
 Oh-oh-oh before you go, Id just love to get a firm commitment on this.  You know maybe sign--
 OK.  Well, thanks for wasting my time tonight, idiot.  God!
 Thanks, Michael.
 I got a knock-knock joke.
 OK, Michael, please, please, please, please, please let me.
  Knock, knock.
 KGB.
  We will ask the questions!
 What are you doing?
 Hey! Hey! Stop it! Stop it!
 Cmon. What are you doing? Mine was a part of my hilarious joke.
 Im not answering it.
 No way, its the KGB.
 Im not answering that. You answer it.
 Im not gonna answer it, its the KGB.
 Its true.
 That was your idea.
 You did. Several times. Over and over again.
  You were dressed as Willy Wonka so...
 Wasnt my idea. Loved - but I cant.
 You dont keep a diary.
 Hold that thought.   March... 4th. Michael Scott came up with golden ticket idea to give five customers ten perfect off for one year.
 To keep secrets from my computer.
 Impossible.
 I wasnt given candy as a child, so a movie that fetish-ized it that much, would have made no sense to me. Plus, we werent allowed to see movies. So... do the math.
 Had conversation with Michael about taking credit for an idea that wasnt mine. Discussed movies.
 With all my heart.
 OK, what am I thinking right now?
 No... How skin is the largest organ of the body.
 Oh, not gonna happen.
 I did fall on my sword once. I was running with it in my belt. Wont happen again.
 What about Shoe La La?
 I love working here and I do not want to leave.
 Well...
 We discussed the fact that Im cooped up here instead of experiencing the whole wide world.
 No plowing my own acres. Going around shirtless all day. You know experiencing freedom.
 Try me.
 I havent made a decision yet.
 No.
 He said he would do the same for me.
 Im gonna go back to work. After I write you up for insubordination.
 David... youre welcome.
 Thats what she said!
 Inspiration.
  You never know when its gonna strike. Just... boom.
 Apology rejected.
 Oh Pam.
 Thanks old man.
 Yeah.
  Cause Ive got this idea...
 Alright.
 OK guys, listen up. Heres the deal. I love candy. Sweet sugary candy from the second it touches my tongue to the moment its metabolized by my stomach acids, so naturally I liked Willy Wonka.
 So I love Willy Wonka. That golden ticket scene is so inspiring to me that thats where I cam up with that idea .
 Pam...
 That is my idea.
 It is my idea.
 It is my idea. Im filled with good ideas. Thousands of good ideas.
 Horse Boat.
 A canoe built around your horse so you can go from riding to water travel without slowing down. Horse Boat!
 Oh give me a break.
 Thats because theyre easy!
  Womens urinals... uh...
 Yes, its Michaels idea that he forced on me on threat of death.
 Oh I am. In my own words.
 No.
 No, Michael.
 No!
 Ding dong.
 KGB.
  When you are done, open the door. ... Hello in there?
 We have more houses to visit.
 We will come back at... how is  445?
 How about 515?
 Very well, we will come back at 515.
  Michael, since it is your fifteenth anniversary at the company, I thought it might be appropriate to begin the festivities with a fifteen-minute round of applause.
  Followed by a fifteen minute moment of silence.
  Jim! Enough with the classy, ok?
  Michael, youre just agreeing with him because hes wearing a tux. Dont you see what hes doing here?
  Oh, heres one  a string quartet, playing classy-cal music.
  Mr. Peanut is not classy.
  He is a regular peanut. He just happens to have a cane, a monocle and a top hat.
  Ok, how about this? An ice sculpture, shaped like you, covered in chocolate-covered strawberries.
  Well, Im sorry, I just dont know what classy is then.
  I said that!
  Originally founded in 1866, Scranton quickly became one of Pennsylvanias largest anthracite coal-mining communities.
  Well finish it up later, but essentially what were talking about is...
  What about your party?
  Ask him about the party.
  No the other thing.
  He hung up?
  Oh, Michael, come on, no. You have to charm em.
  Hey there, gorgeous. How you doing today?
  Hows it hanging?
  Good. Listen, my name is, uh, Michael... Scotch. And, uh, I just wanted to say that, uh, Ive got David Wallaces son in the trunk of my car. If he doesnt get on this phone in 5 seconds-
  Excellent.
  Any really good headhunter would storm your village at sunset with overwhelming force and cut off your head with a ceremonial knife,
   Do you want me to translate the German instructions for you?
  Typical American ignorance that got us involved in a war we never should have been in.  World War II.
  Deutsch... let me see here.  That is either an incense dispenser, or a ceremonial sarcophagus.
  My German is pre-industrial and mostly religious.
  Your own paper company.
   Right...
  What a courageous venture.
  Location is hard for me, with the farm and the responsibilities...
  Okay. So yeah.
  You know, I would love to put a pin in that.
  No.
 Hustle!
 Way to go.
 What?
 This is how I breathe.
 If you want to tell me -
 Oh no! The new boss does not find Jim adorable! Ohhhh!
 Really, Jim? I had no idea you played soccer. Cause you never, ever talk about it.
 Wow.
 You can be so modest sometimes.
  Maybe you and Charles should kick the soccer ball around.
 Maybe you will tonight after work. What do you say?
 Great ideas are just part of what I bring to the table.
 I dont try and be anything that Im not.
 Jim, what do you say?
 Game on!
 Wing.
 Yeah, Jim. Why would an experienced soccer player like yourself duck at the very last moment?
 Let me check.  Oh nope! Clearly a hunter. Who knows how to throw an outfit together.
 Yes, I am taking Andy hunting after work. Not long ago we were sexual competitors. I used to hate him, hate him, hate him, hate him. I studied him, to figure out why I hated him so much.  But that blossomed into a very real friendship, as these things often do.
 You know theres a ghost in this office
 A woman was murdered on this very floor in 1816. Haddie McGonagle. She was a prostitute.
  Oh, this whole place used to be a brothel. There was a tavern on the ground floor.
 Yeah isnt it? She was bludgeoned to death by the business end of a riding crop.
 It was gruesome. They say she walks these hallways. If you ever feel a tapping on your shoulder?
 That could be Haddie. Begging for her life. And it could mean, that youre next.
 Just kidding. You finding everything okay?
 Yeah?
 Erin  Erin...
 Hey buddy.
 Hey buddy, what are you up to?
 Listen, when I saw you talking to Erin earlier, I noticed that your pupils dilated, and your skin flushed, and Im assuming, a little bit of blood rushed into your penis.
 Well, a little bit of blood rushed into mine as well, so where does that leave us?
 And I, yours. So I will cede her to you.
 No no no.
 Look I just want you and I to hang out so, you know. Just,  Boom.
 Youre good.
 Oh its good, youre coming along. Its really technically proficient but really theres no heart or soul in it.
 Hey you want to sing with me? Almost heaven...
 In German! Leben ist dort alt, alter als die Baume, Junger als die Berge, wie eine Brise blasend
 Take it Andy! Take me home, to the place I belong, Ba bah dah duh
 Cherry Pie, Warrant.
 No! Really?
 Enter Sandman, Metallica.
 Rebel Yell, Billy Idol
 Really?
 These sleeves are cutting off my circulation. Not enough blood getting to my hands.
 Doesnt Charles know hes compromising my attack readiness? Its not a dress code. Its a death sentence.
 Kay, thank you. Its a straight jacket!  Okay.
 When Michael was in charge, this place was like the Roman Empire. And the Wild West. And war-torn Poland. And Poland. There was just a lot going on, so what you wore to work was the least of anybodys worries. And in that chaos, I soared.
 Hey. Eds Tires is thinking of making a change.
 They have some great kitchen ideas.
 Its small, I know.
 Thanks, Michael.  Wait, what is this?
 Wh-  I dont need $6 to help a friend.
 Michael, you know I cant take this.
 But dont forget you owe me $10.
 Michael.
 You needed to speak to me?
 I prefer to stand. Less blood clots.
 Do you mean compared to the ways things ran with other bosses? Comparisons are hard.
 Your concern is noted.
 Like a wolf. Thank you.
 Really?
  Its firm.
 I dont know that I can do that now. You know, uh, somethings come up.
 No, Mose is fine. I roped it off. Its not about Mose. Listen, things are changing here, Michael, theyre changing fast.
 Imagine... Someone has a personal hero they really wanna help. But then theres this new guy. Very cool, very Will Smith-esque, who would not like it if he helped his hero.
 Good, do you see what Im saying?
 No.
 No.
 It is possible that I could be talking about us.
 It is the situation that we are in now.
 Im not a barbarian.
 I will.
 Yes?
 Ive said too much.
 Im sorry, Michael
 I did, Michael.  I was upset about the shirt sleeves at first, but now Im okay with it.
  Dwight Schrute.
 I think you have the wrong number, Michael.
  Mr. Schofield, please?
 Dammit!
 I have a long term relationship with Harper Collins publishers and Mr. Schofield. Im not worried.
 And you have bad skin. Oh, look everyone, were all making observations!
 And no, I cannot lower my current prices.  Hold on. Hello? Mr. Schofield, thank you so much for taking the time to talk. I wanted to discuss your contract with us- oh, youre considering him. I thought Michael Scott left the paper business after his nervous breakdown.
 Michael has been talking to my biggest client. Master and apprentice pitted against one another for the fate of the greater Scranton area paper market.  So its not exactly like Highlander, but still...
 I would like to arrange a truce.
 Meet me in our spot in four minutes.
 Michael.
 In which direction?
 At what time?
 That-
  Michael.  Sorry.
 Michael.
 You were making me do things that were not all right.
 And not come through for you?
 I want a truce.
 Let me take you and your whole company out for lunch at Alfredos.
 I had fish yesterday.
 Oh, hi, Michael. Im so sorry Im late. I got stuck in traffic.
 I hit a bear.
 Hes technically fine. I imagine the true horror will be when he wakes up in a zoo.  Hey, listen, will you do me a favor and order the meatball parm for me, with extra cheese?
 Ok, I will see you very soon, alright?
 Did you enjoy your lunch?
 No, Michael, you were sabotaged.
 Me.
 I broke it.
 Yes.
 You think this is some kind of game? No, this is a war, and I will not stop, I will not rest. You have no idea what kind of enemy youve created. You have unleashed the wolf!
 And I knew that you would do that. The meatball parm is their worst sandwich!
 Hi there. Dwight Schrute here. I was just calling to see if Michael Scott Paper was meeting all of your paper needs, and how is  Brenda, age four, ponytail, and Simon, age 7? Oh, you dont say.
  Schrute comma Dwight. And on the back he wrote, "great salesman, better friend."  "Tall" and "beets."
 And say hello to Cheri, who is your black wife.  I see youre begging for mercy, huh?  Well, you will find none here.
 Sure. Thatd be fine.
 This is war and that is what happens.
 Oh, no. No. No. No. No.
 Michael! Michael!
 Dont let him in! Hes a traitor! Michael!
 Are you saying you invented paper?
 Its not the soil! Its the manure! Paper is the manure! On-time delivery is the soil! Aah!
 Spin move.
 Ha ha! April 13th, 2002.
 I barge because I care. April 13th, 2002, that is the date when you tried to switch paper providers for an obscure sociology textbook, but were hung out to dry when the price of glossy stock increased.
 La la la! Continuing.  Notice my persistence and recall. Continuing! You called Dunder Mifflin, and your order was filled within an hour!
 Come on.
 What hes not telling you is that he will abandon you.
 Thank you, Mr. Schofield, for your time. Much appreciated. Oh, and tell me, um, hows your gay son?
 How is Tom, the homosexual sophomore?
  Shame, Jim.  I expected more.
 Its not your fault. Some people just dont want to be inspired.
 Been there, done that.
 David Wallace! Hello, weve been expecting you, David Wallace.  Charles and I were waiting for you.
 Come along, afterthought.
 Stupid.  Yeah, makes us look weak.
  I say we fill Michaels office with bees.  My apiarist owes me a favor.
  No, Jim. I use a bad apiarist.
 Five minutes exactly.
 Sure thing.
  Idiot, were starting back up.  This is Dwight, by the way.
 Let me float something out there, okay?  Can I just say-- can I say something?
 There is a hive of bees outside the front door.  We kidnap the queen, extract her alarm pheromones, place them on a flushable wipe, put that in his bathroom.
 Oh, Man!  If only Michael had children.  Thats how you really apply the pressure.
 You know what?  Why dont I do it, okay? Michael adores me.  Im the man for this job.  Charles, you got my back on this?
 Well, Jerry, the one who got away.  May I ask why youre leaving the Michael Scott Paper Company?  Really?  Please hold.    Charles.
  May I have your attention?  The Michael Scott Paper Company is broke.
  Theyve been calling all of their clients and begging them to pay more money.  That can only mean one thing.  Theyre desperate.  Which can only mean one thing.  Theyre total failures.
 Quiet you.
 You dont crack a case.  That has pejorative connotation.  Thats like calling a policeman a cop.  You solve a case, and yes, Ive solved plenty.
 Im gonna answer Charles first.
 Okay, one. Case of the beet bandit.  Missing beets from all over the farm.  No footprints. Inside job.  Mose in socks.  Boom, case closed.
 Done.
 Im not-- Im not following you.
 Wh--
   Wh--what are you doing?
 Wait, what?
 Yeah , arent we getting those clients back?
 You were bought out.  So the company then bought out all of the stolen clients.
 Fresh hot ink.
 Trust me, Stanley,  youre going to want to read this memo very carefully.
 No, no.  This goes for all of you.  Believe me, you are going to want to heat my words.
 When held over heat the invisible ink will reveal that everyone should meet at the warehouse immediately.  Do not ask me where I got the invisible ink.  Urine.  It was urine.
 Okay, what are you still doing at your desk?
 Did you even read the memo?
 No, you idiot.  There is a code embedded in the memo.  Listen, you need to round up all the salesmen, except for Ryan and Pam, and get them down to the warehouse pronto.
 Stop doing rhyming poetry.  Just tell them, please.  God, the simplest thing.
 Were in crisis mode here, do you understand?  The two unqualified so-called salespeople are being favored because they all failed together.  And frankly, Im not convinced that Michael and Pam didnt have a thing going while they were gone.
 No, youre too close.
  Stanley, how do you feel about those two taking your clients?
 He doesnt like it.
 Her face is okay, but-- Jesus!  What --what are you doing here?
  Get out!  We need to do something.  Im thinking maybe a coup or we take Ryan hostage.
 No, Im not saying we do those things.  Im saying something like those things.
 Excellent question.
 Words will never be enough.
 No, pictures are too interpretive.
 Oh.  Well, that--thats a great idea, Jim.  Oh, I totally see your point.  Okay, well talk to Michael directly.  So uh,  meeting is over, I guess.  Ill see everyone upstairs.
 Cmon.   Guys. Psst, listen.  Now is the time for action.  Im talking action--
 Lunch.
 Its pony.
 Whoa, whoa, whoa, whoa, whoa, whoa.  Give me the phone.  Give me the phone.
 Thats my client.
 Give me the phone.
 Give me the phone.  Tell him Dwight Schrute wants to talk to him.
 Hi, Mr. Bart.
  Hey, its Dwight here.  Give me the phone.
 Dwight Schrute here.  Hey, dont hang up.
 I know times are tough right now,  and I laud your thriftiness.  Ryan!
